dateSejour,situation,titre_comm,comm,loc,langue,dateAvis,note,photo
avr. 2022 , En famille,Deuxième parc à visiter si vous allez à Disneyland Paris.,"Nous n'avons pas eu de chance que la zone Avengers n'ait pas encore ouvert, nous avons donc senti qu'il nous manquait quelque chose à voir. Il se déroule dans des domaines thématiques des dessins animés Disney qui sont un peu plus modernes. Tout et étant très bon, j'ai beaucoup plus aimé l'autre partie du parc.","Sant Climent de Llobregat, Espagne",es,None,"4,0 sur 5 bulles",yes
mai 2022 , En famille,De nombreuses attractions fermées,"Lors de notre visite au parc en mai, de nombreuses attractions étaient fermées, ce qui ne valait pas le prix d'entrée.",1 contribution,nl,None,"1,0 sur 5 bulles",no
juin 2022 , En famille,Top,Super les spectacles et attractions sont de qualité il serait vraiment bien de trouver des idées pour occuper petits et grands durant les longues attentes ✨,2 contributions,fr,Écrit le 24 juin 2022,"5,0 sur 5 bulles",no
juin 2022 , En couple,Chaque souci du détail : c'est magique,"S'il n'y avait pas le nombre de personnes là-bas, ce serait parfait, mais juin est le mois le plus chargé de l'année à Disney et vous devez l'assumer","Madrid, Espagne",es,None,"4,0 sur 5 bulles",no
juin 2022 , En famille,"Excellent paysage, tout le parc est très bien entretenu",Vraiment soigné jusque dans les moindres détails. De belles attractions et de nombreux services. Peut-être que du personnel serait nécessaire pour donner plus d'informations,"Casinalbo, Italie",it,None,"4,0 sur 5 bulles",no
juin 2022, En famille,Étonnante!!! En répétition.,"Une autre expérience avec le sceau Disney à son meilleur. Certaines expériences sont à couper le souffle (Ratatui, Big Thunder Mountain). Toujours propre, bien organisé et beaucoup de nourriture proposée.","Olhao, Portugal",pt,None,"5,0 sur 5 bulles",no
juin 2022 , En famille,Parfait !,"Séjour de deux jours très bien ! Les parades et les illuminations sont magnifiques, et les attractions sont toutes très bien, même si certaines tombent souvent en panne. Seul regret pour le spectacle du Roi Lion que je n'ai pas pu voir car les ouvreuses ont choisi d'arrêter de faire entrer les gens juste au moment où je devais rentrer, alors qu'il n'était pas encore l'heure du spectacle, et qu'il restait selon elles encore des places mais qu'il fallait qu'elles ""ferment les portes""... Une meilleure organisation pour remplir la salle de spectacle entièrement ou pour signaler aux gens qu'ils attendent pendant une demi heure pour rien serait à prévoir. ","Paris, France",fr,None,"5,0 sur 5 bulles",no
juin 2022, En couple,Le pire parc à thème de Disney au monde,"Pas l'un des pires parcs à thème Disney au monde - c'est le PIRE PARC À THÈME DISNEY au monde. Ce parc mal conçu et mal exécuté est sans histoire claire, plan directeur ou ligne d'attractions qui constitue un véritable thème parc - sans parler d'un parc à thème Disney. Nous savons que Disney travaille dur pour remédier à ce problème à long terme - mais cela ne peut pas arriver assez tôt. Sur une note d'angle, le Café Chez Remy est un délice et à ne pas manquer !","Los Angeles, Californie",en,Écrit le 20 juin 2022,"1,0 sur 5 bulles",no
juin 2022, En famille,La souris à gros sous,"Ma petite amie et moi sommes des visiteurs réguliers de Disneyland. Nous attendons toujours avec impatience un voyage magique pour lequel nous sommes heureux de prendre beaucoup de temps et de partir. Nous choisissons donc soigneusement notre visite afin qu'elle ne soit pas en période d'affluence ou de vacances, mais nous n'avons jamais eu une aussi mauvaise expérience que maintenant. Un tiers des studios et une grande partie du parc principal ont été fermés pour rénovation, laissant très peu à faire. Les attractions qui sont constamment fermées en raison d'un trop grand nombre de personnes ou de maintenance entraînent un temps d'attente moyen de 120 minutes pour les autres attractions. Ceux qui veulent/peuvent postuler beaucoup peuvent bien sûr accéder rapidement à tout. Mais l'ère des passes rapides sans tracas est révolue.Beaucoup de ces choses perforent la bulle magique de l'atmosphère qui rend Disney unique. C'est pourquoi la mauvaise visite à Disney n'est pas seulement dommage et frustrante, mais ça fait vraiment mal de ne plus jamais vivre la magie telle qu'elle était autrefois.C'est avec une grande tristesse que nous avons terminé notre 2ème journée tôt à 14h.",1 contribution,nl,None,"1,0 sur 5 bulles",no
juin 2022 , En famille,Un parc plus petit mais bien pensé,"Studios est plus petit que l'autre parc, donc une journée est probablement plus que suffisante pour tout voir. Les manèges sont très amusants et agréables. Il y a moins de manèges pour les petits enfants. Le pire, ce sont les files d'attente, mais cela dépend de divers facteurs.","Porto, Portugal",en,None,"5,0 sur 5 bulles",no
juin 2022 , En famille,je n'y retournerais pas.,"Je suis désolé, mais ce parc ne peut pas être au même prix que Disneyland, plein d'attractions et de choses à faire pour tous les âges. Classement 5* pour : montage, décors, food corners, le quartier de la Ratatouille est très beau avec les spécialités de différents pays européens en version street food.Classement 5* AVEC TEMPS FORTS pour le spectacle MICKEY MOUSE ET LE MAGICIEN : EXCELLENT ! Une scénographie magnifique, des reprises techniques proches de la perfection, de bons danseurs et chanteurs, le rôle du Roi Lion est vraiment magique et spécial avec un chanteur à la voix incroyable. Heureusement qu'il y avait ce spectacle. Ratatouille 5* Ratatouille : très mignon, bien fait et vraiment agréable. Note Nemo's Coaster Crush 2* : je ne le referais plus, une sorte de montagnes russes tournant dans le noir, je n'ai pas aimé ça, compte tenu de l'incroyable publicité que tout le monde lui fait, ça ne vaut pas les attentes. Frose était sur le point de gagner une part du marché des 16/26 ans. 2h de file d'attente le matin, puis attraction fermée jusqu'à on ne sait quand, puis réouverture d'un coup et il y avait déjà 1h30 de file d'attente de personnes qui se sont précipitées par-dessus les cordes pour se fourrer dans le chemin de l'entrée. Je n'ai fait la queue que parce que ma fille en voulait tellement.Classé 4 * Train Cars.Je ne note pas toutes les attractions du parc d'attractions car, au-delà de l'esthétique, elles sont à la hauteur de n'importe quel parc d'attractions: je vais à Disneyland pour le Disneyland magique , pas pour aller dans un parc d'attractions. Les files d'attente sont deux fois plus longues qu'au parc Disneyland car il y a moins d'attractions, donc les gens se pressent devant les entrées avec beaucoup de patience, puis déambulent dans le parc et à la fin celui qui a un billet pour deux parcs va à Disneyland à côté. Je ne peux pas évaluer la tour de la terreur car il y avait une file d'attente et nous devions aller à l'aéroport. Si le prix était proportionnel 40-45eur Disneyland studios et 62eur (ceux effectivement payés pendant la semaine de juin, puis ça augmente ) alors ça aurait du sens. La partie Avengers ouvrira en juillet, pour l'instant beaucoup de décors et pas d'animation.",Italie,it,None,"3,0 sur 5 bulles",no
avr. 2022, En famille,Trop de monde,"Nous y sommes allés pendant les vacances de Pâques et c'est leur 30e anniversaire. Il y avait beaucoup de monde et la plupart des manèges avaient un temps d'attente de plus de 2 heures. Et même certains manèges simples ont un temps d'attente d'au moins 45 minutes. ALORS, N'Y ALLEZ PAS PENDANT LA SAISON DES VACANCES. Le trajet en voiture était génial, alors ne le manquez pas, 5D (peut-être 4D) était génial et les enfants les ont adorés.","Soenderborg, Danemark",en,Écrit le 17 juin 2022,"3,0 sur 5 bulles",no
juin 2022 , En famille,la qualité a chuté,"Les jouets étaient en temps accéléré. Les enfants se sont retrouvés avec le sentiment de ""est-ce fini?"". Terrible expérience, à la fois pour nos enfants qui étaient la première fois, et pour nous adultes, qui étions déjà allés d'autres fois, et clairement quelque chose a changé. Je ne sais pas ce qui aurait pu arriver, mais cette magie a été perdue. Nous n'avons pas vu les personnages se promener dans les parcs, seulement à certains endroits pour prendre des photos, c'est-à-dire quelque chose de statique avec de longues files d'attente. La puissance interne est terrible, avec une valeur pratiquée absurde et un produit de faible qualité. Quoi qu'il en soit, c'était certainement une expérience que nous n'irons plus jamais à Disney Paris.",2 contributions,pt,None,"2,0 sur 5 bulles",no
juin 2022 , Entre amis,Engageant!!,"Parc magique avec une belle marge de progression.. Des attractions nouvelles et bien structurées, des spectacles bien faits et engageants.. Petit frère de l'autre Parc Disney mais avec un excellent potentiel !","Pianezze, Italie",it,None,"5,0 sur 5 bulles",yes
juin 2022 , Entre amis,Terrible. Insuffisant pour les enfants. Trop de monde. Mauvaises vibrations. A ne pas répéter.,"Ce n'est pas un endroit où aller, surtout si vous y allez avec vos enfants. Faire la queue plus de 2 heures pour 1 minute de plaisir modéré est-il raisonnable ? Pas de salle de bain dans la file d'attente. Si vous en avez besoin, vous devez recommencer. Plus de deux heures... Ils permettent à tellement de monde d'entrer qu'on ne peut pas se déplacer à l'intérieur du parc. Expérience horrible. A ne pas répéter.","Lisbonne, Portugal",en,Écrit le 13 juin 2022,"1,0 sur 5 bulles",yes
juin 2022 , En famille,Super journée,"Grand parc avec de grands spectacles. Ce n'est pas aussi grand que le parc principal, mais il y a beaucoup de rénovations en cours et de nouveaux terrains en cours de construction qui semblent être incroyables. En attendant encore beaucoup à voir ici. L'usine à rêves et Mickey et le magicien sont deux grands spectacles. Stitch live est toujours très drôle. L'académie d'animation est géniale et un grand personnage rencontre Olaf, Jessie et buzz. La seule chose qui manque à ce parc, ce sont les choix de nourriture, car il n'y a vraiment que deux choix Chez Remy, ce qui est génial mais difficile d'obtenir une réservation pour ou le restaurant EnCouilisse, qui propose des repas de base et des hamburgers. Sinon, super parc et agréable d'avoir une nuit tôt car il ferme plus tôt que l'autre parc","Dublin, Irlande",en,Écrit le 14 juin 2022,"4,0 sur 5 bulles",no
juin 2022 , En couple,insolence et escroquerie,"L'emplacement est très agréable, mais une arnaque pour le prix d'entrée. Il fallait attendre 1 à 2 heures, parfois sous la pluie, pour 1 à 2 minutes de ""fun"". Nous avons d'abord acheté des livres de signatures pour les enfants. Nous aurions pu nous sauver. Les personnages ne sont là que pendant environ 4 heures, car il faut faire une pause au bout de 30 minutes, ou comme Olaf, 2 heures. Après la pause, vous pouvez attendre plus d'une heure. Vous avez besoin d'une journée rien que pour ça. Un autre problème est que les personnages commencent et finissent en même temps. C'est juste du stress. Une ruée et un chaos. L'application est aussi pour la poubelle. Les horaires ne correspondent pas du tout. Mais après 30 minutes d'attente, vous songez à repartir.",2 contributions,de,None,"1,0 sur 5 bulles",no
mai 2022, En famille,Pas mal,trop de monde !!! le temps au attraction est beaucoup trop long !!! cependant les attractions sont vraiment sympa. Il y a aussi des spectacles qui sont super. Attention il faut faire la queue assez tot...Ratatouille au top !!l'ambiance est sympa. Beaucoup de boutique.,"Toulouse, France",fr,Écrit le 14 juin 2022,"3,0 sur 5 bulles",no
juin 2022 , En famille,Déplorable Disney,"Le tarif soit plus de 400 euros 1 enfant et 1 adulte n’est pas la hauteur des prestations !!!L’attraction it’s a small world ( la maison des poupées) , stars Wars hyper Space mountain fermées également alors que c’est les attractions à faire à Disney.Problème technique à l’attraction pirates des Caraïbes ce qui a engendré une perte de temps et même pas un dédommagement commercial car nous avons dû refaire la queue l’après-midi soit plus d’une heure de temps.Pas de tables pour pouvoir se restaurer auprès des snacks , on mange par terre ! Aux vues des prix de la restauration dans le parc un minimum de service serait très apprécié.Aussi des abris quand on fait la queue en cas de mauvais temps serait très apprécié car nous étions de sortir de la queue vu les fortes pluies de ce week-end et du coup non seulement nous perdons du temps à faire la queue mais en plus nous perdons notre place et nous devons refaire la queue pour finalement faire demi tour car plus le temps de faire l’attraction avec le spectacle du soir car nous devons prévoir une place plus d’une heure avant le spectacle si l’on souhaite avoir au minimum une place assise.En résumé un tarif d’entrée très excessif, même pas pu faire une attraction dans le 2ème parc pour au final peu d’attractions effectuées par manque d’équipements sur site et de problèmes techniques sans même faire un geste commercial !!! La moindre était de prévoir un créneau horaire pour ceux qui était coincé dans l’attraction pour leur éviter de refaire la queue !!! C’est honteux !","Rumilly, France",fr,Écrit le 14 juin 2022,"2,0 sur 5 bulles",no
juin 2022 , En famille,Super,"Très bon service et bon accueil Nous avons été très satisfaits de la visite du parc Bien fatigant pour nous, il n'y a rien d'autre à regarder","Tilburg, Pays-Bas",nl,None,"5,0 sur 5 bulles",no
juin 2022 , En famille,Temps d'attente trop long.,"Les délais d'attente sont vraiment trop longs. Ainsi, pendant 3 jours, nous avons fait la queue pendant près de 20 heures au total.","Bilzen, Belgique",nl,None,"3,0 sur 5 bulles",no
juin 2022 , En couple,"Comme par magie beaucoup d'attente, d'attente et d'attente","Des temps d'attente très longs, une panne après l'autre. Maggie de Disney est alors loin. Vraiment beaucoup d'argent pour pouvoir faire une poignée d'attractions. Ne vaut pas son argent.","Oosterzele, Belgique",nl,None,"2,0 sur 5 bulles",no
mai 2022 , En couple,Perte de temps et d'argent.,"J'ai été déçu, je m'attendais à plus car j'ai payé presque 1000 euros...4 jours j'ai été déçu par les longues files d'attente...pour monter les attractions qui ne sont pas si mal...il n'y a pas de place pour se reposer... assis parce qu'il y a tellement de monde que s'il y a une chaise ou un banc... ben... c'est un commerce, c'est clair... c'est si les magasins sont tous les 5 mètres pour que les gens continuent à dépenser. enfants dans les files d'attente... Le mien en particulier n'a pas beaucoup aimé non plus. Je n'ai que le mauvais souvenir de nombreuses files d'attente, de la chaleur et de l'affluence... et le sentiment d'avoir gaspillé mes économies n'est que mon avis mais ça coïncide avec beaucoup de gens qui sont partis... quelle coïncidence .",2 contributions,es,None,"1,0 sur 5 bulles",no
juin 2022 , En famille,Pas aussi spectaculaire que le parc principal,"De nombreuses zones ici étaient fermées et en construction. Le parc a l'air et se sent très petit et peut-être avec beaucoup moins d'énergie que le principal, du moins c'est comme ça que je l'ai ressenti. En ce qui concerne les manèges... Il y en a 2 que je ne peux personnellement pas apprécier (les parachutes tombent et la tour crépusculaire, qui J'ai essayé, mais l'expérience de monter et descendre est plus écœurante qu'agréable honnêtement). Mais celui de Ratatouille 3D est incroyable ! Tout le monde devrait l'essayer. Quoi qu'il en soit, laissez-le après 2-3 heures car si vous avez l'impression qu'il n'a pas grand-chose à offrir.","Iasi, Roumanie",en,None,"3,0 sur 5 bulles",no
mai 2022 , En famille,Je ne sais pas pourquoi c'est son propre parc,"Nous avons passé 3 heures dans ce parc et avons fait tout ce qui en valait la peine (y compris une heure d'attente pour le Crush Coaster). Crush est une super balade (Space Mountain a fusionné avec Nemo). Ratatouille est un incontournable !!! Le trajet en tram n'est CHOQUANT qu'une scène de cascade (feu de canyon, inondation, etc.). On dirait qu'ils ont manqué de budget.","Orange, Californie",en,Écrit le 9 juin 2022,"2,0 sur 5 bulles",no
mai 2022 , En famille,"Parc Disneyland ou ""Walt Disney Studios"" ???","Parc Disneyland ou ""Walt Disney Studios"" Nous avons réservé plus de six mois à l'avance - c'était un jour férié en Allemagne et, ce que nous ne savions pas, également en France. D'où le titre - Mauvais créneau horaire ! Donc, le parc était bondé de monde. Les attractions sont également trop sollicitées : 3 minutes de plaisir de conduite pendant au moins 50 minutes - ici, le plaisir tombe absolument à l'eau. Le défilé dans la rue principale était également bondé. Alors si vous souhaitez vous rendre à Disneyland Paris, faites attention aux jours de pont et évitez-les, ainsi que les week-ends et jours fériés. Sinon le plaisir se perd dans les longues files d'attente !Attention à tous ceux qui chassent la foule : le billet pour Disneyland Paris a été réservé, acheté et payé (98,00 € par personne). Cependant, à la sortie du RER (gare rapide) vous trouverez l'entrée ""Walt Disney Studios"". C'est alors que la foule afflua. À l'entrée (contrôle des billets), on ne vous a pas demandé ou arrêté, et avant que vous ne le sachiez, vous étiez dans le mauvais parc. Après avoir réalisé que ce n'était pas le bon parc, vous avez été envoyé au comptoir du service client - il y avait aussi beaucoup de gens qui s'étaient retrouvés dans le mauvais parc. Le service client est lent et compliqué : bien sûr, vous pouvez changer le ""Parc Disneyland"" mais s'il vous plaît uniquement avec un achat ultérieur du billet de 98,00 € au montant de 36,00 € par personne. Il laisse un arrière-goût pâle et un trou imprévu dans le budget vacances Dommage !",28 contributions,de,None,"2,0 sur 5 bulles",no
mai 2022, En couple,Certains des meilleurs manèges de Disneyland Paris !!,"j'adore ce parc !! Il est beaucoup plus petit que Disneyland mais possède certains des meilleurs manèges et doit absolument être inclus dans tout voyage à Disneyland Paris. Cela peut facilement être fait en une matinée, mais laissez-y du temps !! Si vous êtes un client de l'hôtel, utilisez un temps magique supplémentaire ici pour éviter de plus grandes files d'attente à Crush's Coaster et Ratatouille. Nous avons couru vers Crush dès l'ouverture du parc et avons marché, puis nous avons attendu 5 minutes pour Ratatouille. Même après avoir terminé à Ratatouille, Crush aurait attendu plus d'une heure, ce qui ne s'est pas amélioré pour le reste de la journée. Ça vaut le coup! Tower of Terror a également de grandes files d'attente qui valent la peine d'être faites le matin, bien que sa file d'attente ait toujours été nettement plus petite que les deux autres. Mickey and the Magician est très divertissant et vaut vraiment la peine de faire la queue.",3 contributions,en,None,"5,0 sur 5 bulles",no
mai 2022, En couple,Où est passé la magie Disney ?,"Inconditionnels des deux parcs depuis leur ouverture, quelle déception !Le Parc Walt Disney Studio n'est plus l'ombre que de lui-même...Nous nous sommes rendus dans ce parc le lundi 23 mai (hors vacances scolaires).Constat : de très belles animations ont disparu : spectacle avec cascades (Cars) et remplacement du tour des studios par un mini tour Cars.Il reste bien sûr La tour de la terreur, Ratatouille, et Némo mais ce parc semble bien vide, et on en fait très vite le tour !!! Enfin c'est vite dit car l'attente pour Ratatouille est très souvent de 60 minutes et 120 minutes pour Némo ! C'est à vous dégouter d'attendre ! Surtout que désormais les Fast Pass ne sont réservés qu'à une minorité de personnes qui peuvent s'autoriser de payer des suppléments hors de prix !Le tour de manège en tapis volant est d'une rapidité extrême, juste le temps de s'asseoir et c'est terminé !Les fast food sont hors de prix pour une famille de 5 personnes, nous avons réglé une facture de 87 €... pour un repas insipide ! Cette augmentation de prix n'a aucune justification sur la qualité, bien au contraire...Enfin les Cast Members n'ont plus la fibre d'antan... on comprend vite que c'est un travail comme un autre. Avant c'était vraiment différent et on avait la réelle sensation de partager un moment à part... C'est terminé désormais, les salariés se racontent leurs vies... et on a parfois l'impression de les déranger : un comble !Dommage, réellement. Nous ne reviendrons car nous avons eu la très désagréable impression de ne représenter qu'une carte bancaire !Mickey nous extrêmement déçu pour notre séjour de deux jours à 5 personnes Il ne nous reverra plus ! THE END",2 contributions,fr,Écrit le 1 juin 2022,"1,0 sur 5 bulles",no
mai 2022 , En famille,longtemps attendu,IL N'Y AVAIT AUCUNE ATTRACTION MOINS DE 60 MINUTES ; Plus encore. Certains fermés à donc trop de billets vendus au détriment des invités - acheteurs.,4 contributions,nl,None,"2,0 sur 5 bulles",no
mai 2022 , En famille,Super mais ..,"Je suis peu objective quand il s’agit de DLP , j’ai même un Instagram sur le sujet c’est pour dire. Ce parc ne vaut pas le grand mais a tout de même ces qualités ! Juste dommage que Ratatouille ne soit plus aussi bien qu’à ces débuts il est vraiment temps de le rénover ! 😫","Paris, France",fr,None,"4,0 sur 5 bulles",no
mai 2022, En famille,Plus petit mais toujours magique !,"C'est un parc beaucoup plus petit comparé à son voisin mais toujours génial ! Il a également beaucoup de potentiel de croissance. La file d'attente est waaaay plus petite et vous vous retrouverez probablement dans la même voiture de toute façon. - Ratatouillesit à l'avant pour une expérience plus immersive - Accès Premium, utilisez-le pour les montagnes russes de Crush. La file d'attente est horrible pour celui-ci et vous pouvez gagner beaucoup de temps ! - Crush's coasterChoisissez les endroits vers l'avant. De plus, c'est un peu plus fort que prévu, il y a quelques virages serrés.","Helsinki, Finlande",en,Écrit le 27 mai 2022,"4,0 sur 5 bulles",no
mai 2022, En famille,super parc !!!,"je me décide a enfin mettre un commentaire au bout de notre troisième visite. j'adore  ce parc a thème. Etant fan de cinéma, comment ne pas aimer cette endroit. On peut toujours parler de prix, de file d'attente ou de travaux et je suis d'accord, mais une fois entré la magie opère , de bonne attractions , des supers décors, etc ...","Saint-Jean-de-Maurienne, France",fr,None,"5,0 sur 5 bulles",no
mai 2022 , En couple,Attente interminable en semaine. Pannes à répétition... ,"Un parc ça !?? Une annexe et encore... Un tiers du parc est fermé pour l agrandissement... Du coup de l attente partout même en semaine ( avant c'était 10 ou 15mn maintenant 45mn voir 120mn toute la journée pour Nemo)... Les attractions tombent en panne: attente de 40mn pour Ratatouille ( au paaage en 2d toute la journée à défaut d être fermée selon le personnel) pour que finalement il ferme et reouvre 1h après, sans possibilité de passer plus vite et sans excuse... Direction tapis volants au bout de 10mn d attente en panne, pareil pour le monde de  toys story... Incroyable... Très peu d attractions possibles et spectacles complets... Ne restez pas dans ce parc pour la journée... Préférez europapark, moins de monde, 3 fois plus d attractions, pas d attente et moins cher.... ","Briançon, France",fr,Écrit le 25 mai 2022,"2,0 sur 5 bulles",no
mai 2022, En famille,de découverte en découverte,"ma découverte principale en venant pour la deuxième fois a DISNEYLAND PARIS ......outre le fulgurant SPACE MOUNTAIN, c'est RATATOUILLE qui m'a le plus interloqué, vraiment prenant une participation presque active a cette attraction filmée !!!","Marseille, France",fr,None,"5,0 sur 5 bulles",no
mai 2022 , En famille,très peu à faire,"Ce parc est trop petit et a peu d'attractions intéressantes. Les plus intéressantes ont en règle générale une file d'attente inabordable (plus d'1h30) et ne compensent pas l'attente ou l'utilisation d'un pass accès rapide. Il y a quelques événements mais il est également difficile d'y accéder en raison du nombre de personnes qui y assistent. En général, très petit et très saturé en raison de l'offre limitée d'activités. Peut-être que ça s'améliorera avec le campus des Avengers, mais pour l'instant ça tient à peine une demi-matinée.",2 contributions,es,None,"2,0 sur 5 bulles",no
mai 2022, En famille,un peu mieux que l'autre parc - mais rien de spécial,"Un peu mieux que l'autre parc - mais rien de spécial ! Trop cher, trop de files d'attente et peu d'émotion - laissez-le tranquille. . . .","Berne, Suisse",it,None,"2,0 sur 5 bulles",no
mai 2022 , En famille,Pas un endroit très excitant.,"Cet endroit a l'air mort, il n'y a pas d'excitation dans l'air. Seuls les bons manèges sont Hollywood Horror Hotel, Crush et Ratatouille. Le reste de l'endroit est ennuyeux. De plus, les gens fument à divers endroits à l'intérieur du parc. Les parcs axés sur les enfants devraient être des zones non-fumeurs.",1 contribution,en,None,"1,0 sur 5 bulles",no
