dateSejour,situation,titre_comm,comm,loc,langue,dateAvis,note,photo
nov. 2021, En couple,Disneyland 3 jours,"Je savais d'avance que ce n'est qu'un tout petit parc. Pas beaucoup d'attractions, pas ce qu'on ose faire. Pour le spectacle gelé, en tant que personne avec un pass vert, il fallait être là une heure pour attendre aussi longtemps. Alors que nous avions un tel laissez-passer vert parce que notre fille peut à peine attendre. Donc nous ne l'avons pas fait. Là aussi, surtout avec les personnages sur la photo et dommage que ceux-ci se trouvaient à l'intérieur des studios, nous avons donc dû porter un masque buccal (ils étaient autorisés en dehors de la période de la photo)",154 contributions,nl,None,"3,0 sur 5 bulles",no
nov. 2021 , En famille,Visite en famille,"Très agréable moment, même si les files sont incroyablement longue. Le personnelle est très agréable et à l écoute. Très propres et les finitions des décores sont poussé à l extrême.","La Louviere, Belgique",fr,Écrit le 2 décembre 2021,"5,0 sur 5 bulles",no
oct. 2021 , Entre amis,Super petit parc,"Pas grand-chose à faire dans ce parc, mais encore quelques manèges emblématiques avec beaucoup de sensations fortes ! Dommage que le RockNRollercoaster fermé ... ça me manque vraiment. La tour de la terreur est tout simplement géniale et le parc n'est pas mal non plus si l'on considère la taille. Dommage qu'il ne s'agisse que d'un parc pour quelques heures et que le nouveau terrain de Toy Story soit un peu un générateur de lignes... les attractions sont très courtes et ont une faible capacité, donc ça ne vaut pas toujours la peine d'attendre.","Baden-Baden, Allemagne",en,None,"5,0 sur 5 bulles",yes
oct. 2021 , En couple,Sympathique!,"Les décors du Walt Disney Studios sont toujours aussi sympa! Beaucoup de monde dans le parc et aussi plusieurs attractions fermées (Armageddon, le spectacle de voitures…). Une nouvelle zone est en travaux, la zone Marvel! A découvrir une prochaine fois. Les temps d’attentes étaient assez long, mais grâce au Single Riders où accès premier vous pouvez éviter les files.Petit message aux personnes de Disney, si elles lisent les commentaires! Mettre une files Single riders ou les billets accès premier pour l’attraction des Tortues!","Lyon, France",fr,None,"4,0 sur 5 bulles",no
oct. 2021 , Entre amis,Les Studios Disney à Paris,"C'est la troisième fois que nous visitons les studios Disney de notre vivant avec des enfants, et encore une fois, cela ne déçoit pas. Toujours plein de monde, il faut être patient pour les files d'attente pour les attractions, mais ça vaut le coup…. C'est de bonnes heures de plaisir.","Pinhal Novo, Portugal",pt,None,"5,0 sur 5 bulles",yes
sept. 2021, En famille,Nous avons été déçu de notre séjour dans ce parc...,"Nous avons été déçu de notre séjour dans ce parc car beaucoup trop d’attentes sur le peu d’attractions présentes, (70 min à 40 min pour 10 attractions voir moins) et ce dès l’ouverture (9h30). Nous avons pas eu besoin de standy by pass pour l’attraction Nemo (accessible toute la journée), donc plutôt une bonne chose vu les problèmes pour réserver.La nouvelle attraction cars road trip est pas terrible (n’étant déjà pas très fan de la première version là c’est pire).Nous ne sommes pas attardé dans ce parc car passé la journée à faire la queue non merci.",4 435 contributions,fr,Écrit le 31 octobre 2021,"3,0 sur 5 bulles",no
oct. 2021 , En famille,Un très bon complément au 1er parc !,"Ce parc est plus petit mais différent,il offre autre chose, tant pour les grands que les petits. Les décors sont magnifiques et réalistes. Les attractions liées a Cars sont trop bien ! Nous avons ete un peu decus par Ratatouille en revanche. La aussi bravo au personnel pour la qualité de l entretien !!! ","Saint-Jean-d'Angély, France",fr,Écrit le 31 octobre 2021,"5,0 sur 5 bulles",yes
oct. 2021, En couple,"grand parc, mais quelques files d'attente plus longues","Que pouvez-vous de plus par rapport à ce que les autres n'ont pas ! Vous pourriez regarder et repérer les défauts ; les manèges ne fonctionnent pas tous, pas de feux d'artifice ni de défilés à cause de Covid en 2021 (et de longues files d'attente pour des choses comme le pass covid), assez cher - à la fois pour entrer et pour les choses à l'intérieur; magasins de nourriture, etc. Mais pour les enfants (petits et grands!), C'est une expérience formidable - avec de superbes manèges, mais les files d'attente sont plus longues ici qu'au parc Disneyland, nous avons donc dû abandonner quelques","Loughborough, UK",en,Écrit le 28 octobre 2021,"4,0 sur 5 bulles",no
oct. 2021, En famille,Files d'attente trop longues et pas assez là-bas,"Il y a actuellement de nombreux problèmes avec les Walt Disney Studios. C'est principalement parce qu'ils font beaucoup de travaux de construction. Pour cette raison, il existe un très petit nombre de manèges disponibles, qui sont tous destinés à des âges beaucoup plus âgés en général, et ont des temps d'attente extrêmement longs presque toute la journée. De plus, en plus des travaux de construction, la qualité de certains les trajets ne sont pas aussi bons, par exemple la relocalisation du Studio Tram Tour pour devenir le Cars Road Trip, car il est maintenant beaucoup plus court et il y a moins à voir. En plus des heures plus courtes, il est assez difficile de passer une journée dans ce parc, il s'agit donc plutôt d'une demi-journée pour les personnes qui aiment les manèges passionnants - il ne convient pas vraiment aux familles avec de jeunes enfants. Mais avec tout cela dit, une fois le les spectacles reviennent aussi, ce sera beaucoup mieux, j'en suis sûr, et bien sûr le plaisir de certains manèges etc. est toujours là !","Brentwood, UK",en,Écrit le 25 octobre 2021,"3,0 sur 5 bulles",no
oct. 2021, En famille,trop près,"Nous ne nous sommes même pas promenés ici pendant une journée complète, mais les enfants ont apprécié les attractions qui étaient ouvertes",9 contributions,nl,None,"2,0 sur 5 bulles",no
oct. 2021, En famille,Longs délais d'attente,Temps d'attente très long aux attractions. Mais sinon très bien fait. J'ai hâte de voir quand les rénovations seront terminées.,"St. Wendel, Allemagne",de,None,"4,0 sur 5 bulles",no
oct. 2021 , En famille,N'y allez pas pour le moment,"Le premier problème de cette attraction est le manque d'informations sur leur site Web sur ce qui est ouvert et ouvert au parc en ce moment. Il annonce des spectacles et des restaurants. Aucune carte que j'ai pu trouver. Les informations étaient également médiocres lorsque nous sommes arrivés là-bas. De nombreux restaurants, boutiques et spectacles sont fermés. Quand je me suis plaint au centre d'information, on m'a fait remarquer que les émissions étaient en fait des opportunités de ""selfie"" avec des personnages. Je pense que le seul spectacle que j'ai pu voir était Stitch. On m'a dit que le problème était COVID. Si tel est le cas, soyez honnête et expliquez-le en détail sur le site Web et n'essayez pas de dissimuler le divertissement réduit et ne CHARGEZ PAS le plein tarif. S'il vous plaît Disney, si vous lisez ceci, ne répondez pas avec un commentaire standard et ""bienvenue-moi"". Donnez-moi un remboursement partiel. C'est une arnaque.","Brighton and Hove, UK",en,Écrit le 11 avril 2022,"1,0 sur 5 bulles",no
oct. 2021, En famille,Des améliorations peuvent être apportées,"Ce parc a pas mal de bons manèges, mais comme dit à plusieurs reprises auparavant, il manque généralement de thème global. Bien que certaines zones soient assez bien thématisées (par exemple, Toy Story Land, Ratatouille), en dehors de ces zones, le thème semble être ""Concret"". Bien que je comprenne que de grands changements sont à venir dans les prochaines années, et je ne doute pas qu'ils amélioreront considérablement le parc, pour l'instant, je pense que c'est peut-être le parc Disney le moins bien classé pour moi. Mon avis serait de le renommer et de se débarrasser du thème du studio, car cela ne fonctionne pas tout à fait à Paris. Peut-être le changer. juste ""Walt Disney Park"", puis faites un retheming. Cela pourrait probablement même être fait avant l'ouverture des nouvelles zones. Au plaisir de visiter après les extensions pour peut-être faire une nouvelle critique. Merci!",2 contributions,en,Écrit le 21 octobre 2021,"3,0 sur 5 bulles",no
oct. 2021, En famille,Ça va …,"Parc petit , beau propre et calme surtout en semaine , j’ai pu faire ratatouille deux fois. Point négatif : on ne peut pas fumer dans le parc alors que nous somme dehors sinon on se prend 135€ d’amende une honte !!! Ok il y a des enfants mais après coronavirus faut pas abuser les prix et mettre des amendes au gens … Je me sentais oppressée à l’idée de me ramasser une amende partout ou j'allais,Autre point négatif le parc qui ferme à 18h deuxième honte c’est quoi ça,,,,!! Payer pour partir à 18h Et autre honte payer un sac Disney shopping 1.50€ soit disant car c’est réutilisable.","Woluwe-Saint-Lambert, Belgique",fr,Écrit le 11 octobre 2021,"3,0 sur 5 bulles",no
sept. 2021, En famille,Magnifique,"Le parc est magnifique et chaque visite est un vrai bonheur. Tout est parfait, tout est beau, tout est bien pensé et les attractions sont géniales (aussi bien pour petits et grands).","Lille, France",fr,None,"5,0 sur 5 bulles",no
févr. 2021, En solo,Le meilleur des 2 parcs,"Personnellement, en tant qu'adulte je préfère ce parc au parc principal.Les attractions sont vraiment bien, il y a moins de monde en général et l'abiance est très différente.Les différents shows de ce parc sont vraiment excellent, il vous suffit de regarder les horaires et en général il y a de la place pour tous.Je recommande vivement!","Bruxelles, Belgique",fr,None,"5,0 sur 5 bulles",no
févr. 2021, En famille,"Un deuxième parc très bien, mais...","Il manque l'ajout de nouveautés dans ce parc, qui semble à l'abandon en fonction des saisons, mais dans l'ensemble, les attractions sont à la hauteur, excellentes et variées. ","Noeux-les-Mines, France",fr,None,"4,0 sur 5 bulles",no
sept. 2021 , En famille,Nul,Nul a été refuser a l' entrée pour un pass sanitaire qui soi-disant n est plus bon hors que a 16h il était encore bon. N importe quoi pourtant on est dans la même journée vraiment honteux très déçue de Disneyland.,2 contributions,fr,Écrit le 5 octobre 2021,"1,0 sur 5 bulles",no
sept. 2021 , En famille,Expérience très moyenne,"50 % du parc est fermé à cause des travaux, mais il y a autant de monde qu'avant. Un temps considérable passé dans les files d'attente, pour 2 minutes d'attraction.  La question est : pourquoi le tarif est le mème pour un demi parc ?La réponse est simple : il faut générer du cash pour compenser les deux milliards d'investissements de travaux en cours, au détriment de la satisfaction des clients.Quand l'impression de se faire avoir est présente, c'est qu'il y a problème.",1 contribution,fr,Écrit le 28 septembre 2021,"2,0 sur 5 bulles",no
sept. 2021 , En couple,Lamentable honteux,"La moitié des attractions du parc studio sont fermées, résultats 2 fois plus d attente que dans l autre parc disney.A eviter à tout prix","Berneval-le-Grand, France",fr,Écrit le 26 septembre 2021,"1,0 sur 5 bulles",no
sept. 2021 , Entre amis,Cauchemardesque,"Le parc est toujours agréable dans l idée , mais la magie se perd et tout devient rapidement cauchemardesque:Apres une période de COVID, la machine a billet doit être relancée et l abus est de mise.30e de parking, des places excessives mais ce n est pas encore le problème!Un parc submergé de touristes, je serais d ailleurs surpris que les quotas soient respectés!1h de queue partout, même le labyrinthe d alice ou l arbre de robinson étaient pris d assaut par dépit par les visiteurs! Un grand nombre d attractions fermées! Un recours le fast pass! Arrivant a 12h au parc après 1h40 le temps rentrer au parking saturé et récupérer des places réservées, une fille de 4 ans déjà fatiguée, pas le choix que de céder a ce système rapide pour au moins faire  4 attractions: 14e par tete juste pour ratatouille, on est 5…..Allez je paie et là 15 min de queue quand même, une honte! Ca m étonnerait que la centaine de personne devant moi ai payé 14e! J étais le seul devant l entree rapide avec ma carte et mon téléphone a gérer l achat!On veut manger, tout est saturé!On passe au magasin, je prends mon souvenir: est ce que je veux un sac , c est payant? Pas de soucis!1 euros 50 le sac😂Bilan journée a 520e en ayant des prix, sans manger et en ayant fait 4 attractions!L arrière gout est amère!J ai eu le pass annuel plusieurs années, je maitrise les journées d affluences , mais tout s est perdu avec le temps! Je ne reconnais plus le parc, walt se retourne dans sa tombe!",3 contributions,fr,Écrit le 26 septembre 2021,"2,0 sur 5 bulles",no
sept. 2021, En famille,Trop de palissades,"Des défauts de fonctionnement, trop de travaux. des attractions qui n'ouvrent qu'après l'ouverture du parc...","Arpajon, France",fr,Écrit le 25 septembre 2021,"3,0 sur 5 bulles",no
juil. 2021, En famille,a oublier,"tout comme pour l'autre parc disney  nous avons regretté y etre allé. même principe, même punition! a éviter avec des enfants en bas âges.","Paris, France",fr,Écrit le 11 avril 2022,"3,0 sur 5 bulles",no
sept. 2021, En famille,Ne vaut pas le détour,"Quelle déception !!! Le personnel des attractions désagréables, seul celui des boutiques est souriant et le cast member d'un point selfie (princesse et mickey). Quand on discute avec le peu de Cast member aimable il nous indique que l'ambiance entre eux n'est pas aussi sympa que dans l’autre parc et vraiment cela se ressent!!!Peu d'attractions à faire, le nouveau circuit cars est minable et ne vient pas à la hauteur de l'ancien parcours qui existait avant! Plus de beaux spectacles comme avant, remplacés par des points selfies donc on passe sa journée à faire la queue pour faire une photo!!!Le restaurant bistrot chez Rémy est à fuir ! Ce parc est une perte de temps en l'état, il serait peut être plus judicieux de le fermer en attendant la fin des travaux ou de faire un passage entre les 2 parcs pour donner directement l’accès à la seule zone exploitable sans devoir passer encore une fois par des portiques.",7 contributions,fr,Écrit le 18 septembre 2021,"1,0 sur 5 bulles",no
août 2021, En famille,Moyenne,"Malheureusement, en tant que personne qui n'aime pas les grands manèges, ce parc n'est pas si bon pour moi. Ce que j'apprécie vraiment chez Disney, c'est toute la thématique et la magie qu'ils créent même sans avoir besoin de grands manèges. Il s'agit plus des grands manèges sans la magie. Je pense que le thème Disney qui distingue Disney des autres parcs à thème doit être amélioré ici. Les manèges sont bons, me dit-on, mais la magie n'est pas là.","Weymouth, United Kingdom",en,Écrit le 10 octobre 2021,"3,0 sur 5 bulles",no
mars 2021 , En couple,Disney Mans pâtis c un beau parc y’a plein de manège y’a des manèges à sans sa timon et d’autres pour enfant c’est très,Disney Mans pâtis c un beau parc y’a plein de manège y’a des manèges à sans sa timon et d’autres pour enfant c’est très beau,"Los Angeles, Californie",fr,None,"5,0 sur 5 bulles",no
sept. 2021 , En famille,Ne vaut pas le déplacement contrairement au vrai parc Disney,"2 étoiles pour1/le personnel.qui fait son possible pour être gentil et agréable2/la propreté et les jardins bien entretenus du parc.Pour le reste, trop peu d'attractions comparées aux IMMENSES queues (jusqu'à 2h20 pour crush's coaster.. limite malaise pour 1mn30 de manège à sensation....)je ne reviendrais plus dans ce parc tant qu'il n'y aura pas de fastpass comme avant et tant qu'il n'y aura pas plus d'attractions.Pour les repas  ""sur le pouce"" on a pu trouver un camion qui se limitait à vendre des hot-dogs/paquets de chips..aucun choix de sandwichs et le peu de restaurants présents dans ce parc  affichaient complet (avec des menus à 35 euros quand même chez Rémy)réservation uniquement internet...cela dit quand on vient à Disney pour le WE après 550km on ne peut pas passer 2h à table à midi non plus car on loupe les innombrables queues à faire ainsi que le spectacle de la fabrique à rêves pour lequel 40mn minimum d'attente sont nécessaires aussi.Bref déçue.",1 contribution,fr,Écrit le 13 septembre 2021,"2,0 sur 5 bulles",no
sept. 2021, En famille,Bien mais manque,"Vraiment petit parc quelques bons manèges - tour de la terreur, montagnes russes écrasées, ratatouille. Peut se faire en une demi-journée avec le vent dans le dos. Nourriture moyenne mais très chère. Disney fait clairement de l'argent avec des produits qui sont tellement trop chers. Les heures magiques étaient médiocres - rien d'ouvert et ce qui n'était toujours pas prêt. Veuillez ouvrir les manèges à l'ouverture du parc.","Milton Keynes, UK",en,Écrit le 13 septembre 2021,"3,0 sur 5 bulles",no
sept. 2021, En couple,A FUIR,par où commencer! la moitié du parc fermé donc des files d'attente interminables space mountain en panne 3 fois dans la journée donc pas pu le faire arrivé devant ratatouille en panne pas pu faire les tortues car il fallait réserver par un pass que l on a jamais pu obtenir malgré nos nombreuses connexions à l'application ! il aurait peut-être fallu payer (je pense que le but est là)mais à 15€ par personne et par attraction ça fait un peu cherot les 1mn de manège non???!!!! le prix d'entrée du parc est déjà assez élevé pour une moitié de parc! Très peu de kiosques  de sandwicherie ouverts donc 1h30 pour avoir une malheureuse pizza autant de temps pour un hot-dog et le comble du comble machine à CB en panne quand c'est notre tour!!! Par contre toutes les boutiques sont ouvertes . Disney parc à fric  plus aucune magie   A fuir,3 contributions,fr,Écrit le 12 septembre 2021,"1,0 sur 5 bulles",no
août 2021, En famille,Encore des travaux !,"J'ai été déçue par le fait qu'il y ait encore des aménagements et qu'une partie du parc ne soit pas ouverte. Dommage ! Je pensais qu'avec la fermeture du parc, ils auraient eu le temps de faire les travaux.","Narbonne, France",fr,Écrit le 9 septembre 2021,"3,0 sur 5 bulles",no
sept. 2021 , En famille,Très amusant,"J'ai trouvé ce parc plus amusant que le parc principal de Disney lui-même, la célébration du film et de Pixar est tellement amusante et j'ai passé une très belle journée dans ce parc.","Belper, UK",en,Écrit le 7 septembre 2021,"4,0 sur 5 bulles",no
sept. 2021, En famille,bon parc,"Plus petit que Disneyland mais il a des attractions et des spectacles intéressants, en une journée, vous pouvez tous les visiter.","Barcelone, Espagne",es,None,"5,0 sur 5 bulles",no
août 2021, En famille,Médiocre,"Si vous aimez les parcs d'attractions, choisissez-en un autre. Pour les bonnes attractions (peu nombreuses), il y a des files d'attente d'au moins 45 minutes, et nous y sommes allés chaque semaine. Il n'y a que des laissez-passer de réserve pour un, et peu. Tout au long de la journée, beaucoup ferment pendant un certain temps en raison de problèmes techniques. Au moins, nous nous sommes plaints et ils nous ont donné 3 laissez-passer de premier ordre pour nous dédommager. L'attractivité des boutiques et des restaurants est plus soignée que le plaisir lui-même. La nourriture moche. Je ne le recommande pas sauf pour les très fans de Disney. La chambre de l'hôtel Cheyenne était très bien, hormis l'odeur des tuyaux.Les ""mesures de prévention"" du Covid dans le parc sont regrettables. À l'extérieur, le personnel vous interpelle si vous sortez sans masque, mais pas si vous le portez sous le nez. Cependant, dans les files d'attente, y compris dans les espaces fermés, personne ne se soucie que vous ayez le masque. Il n'y a pas d'espaces de sécurité à l'intérieur des restaurants, qui sont pleins. Sous prétexte de Covid, les défilés et spectacles en plein air ont été suspendus. Tout une pantomime pour économiser les dépenses.",3 contributions,es,None,"2,0 sur 5 bulles",no
août 2021 , En couple,Moins d'attractions que dans l'autre parc et beaucoup d'attente. Dommage car très sympa sinon,"Moins d'attractions que dans l'autre parc. Les temps d'attente sont très importants et pénibles. Même avec le standby pass sur l'appli pour accéder à crush coaster, nous avons fait + 1 heure de queue. C'est vraiment pénible à la longue.Les décors sont impressionnants. Le parc est très propre et le personnel est très agréable. Ça aide à faire passer un peu l'image négative / attentes aux attractions.",11 contributions,fr,Écrit le 1 septembre 2021,"3,0 sur 5 bulles",no
août 2021, En famille,Pour l'instant ça ne vaut pas le coup,"Beau parc, mais à faire uniquement s'il est inclus dans le forfait de plusieurs jours, actuellement cela n'en vaut pas vraiment la peine, car une partie du parc est en rénovation et les files d'attente pour les attractions sont TROP longues (plus d'une demi-heure partout)","Braone, Italie",it,None,"3,0 sur 5 bulles",no
juil. 2021, En famille,"Amusant, occupé et en construction et pas de spectacles.","Bien sûr Euro Disney est fantastique avec les enfants, l'ambiance les attractions mais je voudrais noter ce qui suit. Ratatouille... fantastique, l'ascenseur... fantastique, mais c'est là que ça se termine vraiment dans ce parc. Nous voulions entrer dans la tortue de mer, mais quand c'était presque notre tour, il y a eu un dysfonctionnement, nous avons eu ça au total 5x en 2 jours dans les deux parcs !!! Le parc vieillit-il vraiment ou avons-nous simplement été malchanceux? De plus, le parc Studio est en cours de rénovation pour les cerfs, il n'y a tout simplement pas grand-chose à faire, également à cause de Corona, mais il n'y a pas de spectacles. Il y a quelques personnages qui se promènent de temps en temps mais c'est tout. Honnêtement, j'ai trouvé ça décevant, nous avons certainement passé un bon moment en famille mais c'était parce que c'était décontracté et nous sommes allés nous détendre sur l'herbe. Par rapport à Disney Land c'était donc décevant, nous aurions préféré rester 2 jours dans le grand parc.","Groenlo, Pays-Bas",nl,None,"2,0 sur 5 bulles",no
août 2021 , En couple,Ça ne vaut pas le coup!,"Par rapport au parc Disney .. les studios sont un parc d'attractions tout à fait normal .. avec 10 manèges , d'ailleurs très normaux .. 2/3 avec des décors particuliers .. et des files d'attente évidemment hallucinantes !!! Mais pour le prix du billet ça ne vaut pas le coup à mon avis !! Mieux vaut passer son temps dans l'autre parc !!!",163 contributions,it,None,"2,0 sur 5 bulles",no
août 2021, En famille,Pas à la hauteur de la version Floride,"Trois et demi. Très bien situé, mais petit et rapidement terminé le parc. Choix de restaurants limité. Une ombre de la version Floride. Les manèges étaient amusants - mais les files d'attente étaient longues. Je passerais plus de temps au parc Disneyland à côté.","Bruxelles, Belgique",en,Écrit le 13 septembre 2021,"3,0 sur 5 bulles",no
août 2021 , En famille,Vaut le détour,"Il y a beaucoup d'endroits intéressants, le paysage vaut le coup d'œil. Les repas du restaurant sont délicieux et pas chers. Le spectacle de lumière du soir est inoubliable, rappelle beaucoup de souvenirs d'enfance.",France,en,None,"5,0 sur 5 bulles",yes
août 2021, En famille,du rêves et de l'attente,"La magie est toujours présente dans ce parc, le seul bémol c'est les temps d'attentes qui ne correspondait pas à ceux qui était affiché sur l'application. Dommage qu'en ayant développer une bonne application elle ne soit pas utilisé dans tous ces moyens possibles. Les spectacles sont complets une heure avant et cela n'est dit nul part, les rencontres avec les personnages sont inaccessibles à cause de trop d'attente. Le personnel du parc est très gentil.","La Mure, France",fr,Écrit le 29 août 2021,"4,0 sur 5 bulles",no
août 2021 , En famille,Manque d'attractivité ,"Parc où il n'y a pas beaucoup d'attraction c'est dommage. Et pas beaucoup d'endroit où se restaurer !! Je sais que la parc a s'agrandir... Mais quand même 🙃.Bcp de monde à cruch croster, et la tour de la terreur. ","Salon-de-Provence, France",fr,None,"4,0 sur 5 bulles",no
août 2021 , En couple,Déception,Très décevant . Beaucoup d’attractions fermées et qui engendrent des temps d’attente hallucinants pour un temps très court d’attraction ( tapis volant 45 min pour 1 min 25 d’attraction ).Je conseille de ne pas y aller et d’attendre les nouvelles attractions . Attention prévoir un budget conséquent car les prix sont exorbitants de l’entrée au restaurant en passant par les boutiques et le parking,"Mondeville, France",fr,Écrit le 27 août 2021,"2,0 sur 5 bulles",no
