dateSejour,situation,titre_comm,comm,loc,langue,dateAvis,note,photo
déc. 2022 , En famille,Tout simplement fantastique !!!,"Parc à thème magnifique, jeux avec peu de file d'attente sauf pour NEMO... roller cast in the dark spectaculaire, pas pour les petits... mais à faire.Parc soigné dans les moindres détails, campus Avengers à voir absolument comme le tour de l'hôtel.... de fortes émotions !Excellent choix et variété pour se restaurer, moins cher que le parc Disneyland....","Rome, Italie",it,None,"5,0 sur 5 bulles",yes
déc. 2022 , En famille,Super héros Temps fantastique,Expérience fantastique. Nous avons vu pas mal de personnages merveilleux. Nous avons passé un très bon moment et avons trouvé que c'était un peu moins occupé que l'autre parc. Il semble également que des travaux soient en cours pour de nouvelles attractions. J'ai également été impressionné par la propreté du parc.,"Londres, UK",en,None,"5,0 sur 5 bulles",yes
oct. 2022, En couple,Une journée au Parc et Studio,"Nous avions des billets pour le parc et le studio, ce qui nous donnait suffisamment de flexibilité pour nous déplacer entre les deux et faire la queue pour les files d'attente plus courtes (utilisez l'application Disney !). Nous nous sommes bien amusés et nous reviendrions - probablement encore pour les deux parcs. Le feu d'artifice et le spectacle de lumière étaient super. Cela valait la peine de rester jusqu'à la fin et de faire quelques manèges quand il faisait noir. ce fut une expérience incroyable. 4 étoiles sur 5 car lorsque nous sommes arrivés avec le train, il y avait deux files d'attente. L'un était pour les personnes qui séjournaient à l'hôtel et l'autre sans hébergement à l'hôtel. mais il n'a été affiché nulle part et nous n'avons réalisé que nous étions dans la mauvaise file d'attente que lorsque c'était notre tour. Nous avons donc fini par faire la queue une deuxième fois. Ce qui était complètement inutile avec une meilleure signalisation. De plus, pendant le feu d'artifice / spectacle de lumières, il y avait à peine assez d'espace et les gens ont commencé à se pousser et à se crier dessus. Certaines scènes laides, en particulier avec des familles avec de petits enfants et des landaus. ces émissions se font quotidiennement. Ils devraient vraiment assurer une meilleure façon pour les gens de se déplacer. certains criaient même aux employés de Disney. Cela a en quelque sorte refroidi l'atmosphère pour moi à la fin.","Bad Zurzach, Suisse",en,None,"4,0 sur 5 bulles",no
déc. 2022 , En couple,Autour de perdre du temps,"Après un billet à 70 euros (à partir du 10 décembre 100), vous vous retrouvez dans un parc où il y a 3 attractions qui valent peut-être la peine, mais il y a jusqu'à 120 minutes d'attente. Si vous aimez, entrez. Il nous est arrivé 2 fois qu'après 1h d'attente inutile à cause de problèmes techniques nous avons été obligés de partir. Voir Car racer le 9 décembre et Thunder Mountain le 7 décembre. Si vous voulez éviter la file d'attente, 13 euros supplémentaires par personne. A éviter absolument",419 contributions,it,None,"1,0 sur 5 bulles",no
déc. 2022, En famille,Je recommande!,Nous avons apprécié l'ambiance et les attractions de Noël même s'il faisait assez froid. Nous serons de retour!!,"Bucarest, Roumanie",en,None,"5,0 sur 5 bulles",no
déc. 2022 , En couple,Grands services tragiques du parc,"Grand parc, services tragiques. Il n'y a pas de limite aux visiteurs du parc, donc les services sont horribles. Des heures d'attente même à O degrés avec de la pluie et de la neige. Vous ne pouvez pas manger, vous ne pouvez pas utiliser les toilettes sans attendre des heures et tout est très sale et ils vous traitent comme si vous ne payiez pas. L'argent est avant tout et vos rêves rencontrent la réalité. N'essayez pas même en semaine la même chose. Les week-ends encore pires.","Athènes, Grèce",en,Écrit le 13 décembre 2022,"1,0 sur 5 bulles",no
déc. 2022 , En famille,Ne vaut pas le détour,"Trop de file, trop d attente Temps d attente sous évalué et ne reflète pas la réalité Vraiment déçu de notre expérience !!",14 contributions,fr,Écrit le 13 décembre 2022,"1,0 sur 5 bulles",no
déc. 2022 , En famille,Le campus des vengeurs est magnifique,"Comme toujours, vous respirez la magie de Disney, la belle nouvelle zone du campus Avengers vaut vraiment la peine d'être visitée et de s'y perdre toute la journée","Pescara, Italie",it,None,"4,0 sur 5 bulles",yes
nov. 2022 , En couple,Merveilleux,"Expérience fantastique à vivre, il faut notamment aller à l'hôtel hollywood je ne vous dirai rien pour ne pas spoiler mais c'est une attraction flippante.... je vous laisse découvrir la suite :-)",7 contributions,it,None,"5,0 sur 5 bulles",yes
nov. 2022 , En famille,encore beaucoup de monde,"superbes attractions mais encore bcp de monde. 70 min pour Spiderman, du coup nous ne l'avons pas fait, 70 min pour les tortues, obligé d'acheter un fast pass. dommage que les fast pass soient payant maintenant...",4 contributions,fr,Écrit le 1 décembre 2022,"3,0 sur 5 bulles",no
nov. 2022 , En famille,Moment de plaisir pour une première visite,"C'était notre première fois et c'était assez amusant. Ce n'est pas comme les autres parcs à thème avec un thème Disney lourd et des oreilles de Mickey partout, mais les manèges sont très amusants. Les temps d'attente sont assez longs pour l'aventure Crush's Coaster et Spiderman's Web, donc si vous voulez essayer ces deux-là, essayez-les avec votre passe magique lors de l'entrée anticipée ou attendez-vous à attendre. The Avengers Flight Force et Hollywood Tower of Terror avaient également des temps d'attente qui allaient et venaient et tout au long de notre séjour ici, les temps d'attente pouvaient être d'environ 15 minutes ou moins à des moments aléatoires de la journée. La balade Ratatouille était très bien faite mais nous sommes sujets au mal des transports. La nourriture est assez bonne ici et vous pouvez obtenir de bonnes collations sur le pouce, du vin chaud et de la bière très facilement. Le Bistrot Remy a été un moment fort pour nous, mais nous avons dû vérifier plusieurs fois pour obtenir une réservation et nous avons eu de la chance le jour où une place libre a été trouvée en milieu de journée au parc - vérifiez tôt et souvent si vous voulez essayer ! Il y a une tonne à faire dans ce parc et vous pouvez faire la plupart des manèges en moins d'une journée ici. Si vous avez le temps, nous vous suggérons d'obtenir un laissez-passer de 2 jours pour le parc et de passer la première moitié de la première journée ici, puis d'aller à Disneyland. Walt Disney Studios ferme tôt en semaine et le thème est beaucoup plus impressionnant à Disneyland, plus les feux d'artifice et les défilés se déroulent tous dans l'autre parc ! Nous n'avons eu aucun problème pour entrer et sortir de l'un ou l'autre des parcs, donc quelque chose à garder à l'esprit si vous êtes un amateur de parc extrême.","Edmonton, Canada",en,Écrit le 2 décembre 2022,"4,0 sur 5 bulles",yes
nov. 2022 , En famille,Rencontre avec la figurine disney,"La rencontre avec le personnage de Disney, Olaf, a pris trop de temps, ce que vous ne pouvez pas estimer à l'avance. De nombreuses personnes bénéficiant d'un accès premium ont obtenu la priorité ou les utilisateurs de fauteuils roulants. (1 heure et 15 minutes) Vous connaissez le temps d'attente pour de nombreuses attractions, mais je pense que c'est extrême pour quelque chose comme ça.Deux attractions étaient indisponibles pendant un certain temps en raison de problèmes techniques. Les spectacles au parc étaient extrêmement bons.",1 contribution,nl,None,"4,0 sur 5 bulles",no
nov. 2022 , En famille,mieux que Disneyland,"Nous avons passé une journée dans chaque parc. Et pour n'en choisir qu'un, ce serait Disney Studio, bien que les deux soient assez similaires, le prix est disproportionné. Cela ne correspond pas aux attractions. Quiconque recherche du plaisir, mieux vaut port aventure","Aviles, Espagne",es,None,"4,0 sur 5 bulles",no
nov. 2022 , En famille,Ma visite en novembre 2022,Agréable à visiter. Mais il faudrait avoir un plan pour faciliter l'organisation de la visite. Néanmoins le restaurant était blessant avec un très mauvais service à table. Le jeune homme dans la chambre était très impoli et inapproprié avec les clients (au restaurant Stark).,"Oliveira de Azemeis, Portugal",en,Écrit le 23 novembre 2022,"4,0 sur 5 bulles",no
nov. 2022 , En famille,Bien mais pourrais étre beaucoup mieux !,"le prix du parc par rapport a celui du grand parc est excessif car pas autant d'animation, toujours autant d'attente au crush'n coaster !! prix de la restauration très élevé, jeux proposés dans les boutiques proposé a des prix élevé mais pas assez représentatif (marvel... star wars) , zone marvel les décors sont jolis mais il y a un gout de ""trop peut"" dommage ",1 contribution,fr,Écrit le 22 novembre 2022,"3,0 sur 5 bulles",no
nov. 2022 , En famille,très amusant,C'est un monde différent des autres parc qui est adapté aux enfants. Super les nouvelles attractions du monde Marvel. Faire 2 parcs en 1 journée est très difficile car les files d'attente sont souvent longues.,"Sesto San Giovanni, Italie",it,None,"5,0 sur 5 bulles",no
nov. 2022 , En famille,visite à studio,"excellente vite dans parc studio surtout avec l'option pass premium qui évite les files d'attente en bonus, le show Mickey et le magicien, spectacle remarquable ",1 contribution,fr,Écrit le 22 novembre 2022,"5,0 sur 5 bulles",no
nov. 2022, En famille,Attention aux fumeurs,"J'ai visité de nombreux parcs Disney à travers le monde et ce fut définitivement une expérience différente. Le nombre de fumeurs dans tout le parc (à la fois Disney et Studios!) A vraiment gâché mon expérience Disney. Fumer n'est autorisé que dans la zone fumeurs désignée par la règle de Disney, mais tant de gens fumaient en marchant, faisant la queue pour un tour et même au milieu de la rue. Ce qui m'a encore plus surpris, c'est qu'AUCUN des membres de la distribution n'a dit quoi que ce soit à ces fumeurs ! Je ne pense pas que je retournerai au Disney Paris.",1 contribution,en,Écrit le 21 novembre 2022,"3,0 sur 5 bulles",no
nov. 2022 , En famille,Avenger Assemble a effrayé notre tout-petit et a gâché les vacances,"Nous sommes allés attirés par la nouvelle zone thématique Marvel pour faire vivre à notre enfant une merveilleuse expérience pour ses 8 ans.La reconstitution des environnements est très sympa, mais la zone thématique n'est pas très vivable pour les enfants...à mon avis plus adaptée pour ados et adultes. Ici on fait la queue pour Avenger Assemble sans pouvoir comprendre ce qui pourrait nous attendre, l'appli rapporte hauteur 120 cm (vérifiée à l'entrée) convient aussi aux enfants, des sensations fortes… On ne savait pas que c'était un high -des montagnes russes rapides et dans le noir…Le bébé ne pouvait pas serrer la main de son père parce qu'il devait tenir bon. Il est sorti très effrayé et, de toutes les bonnes choses que nous pouvions faire, l'émotion négative l'emporte… obscurcissant tous les moments agréables passés. Le WEB c'est amusant, mais avec de longues files d'attente. La formation des héros est un plateau photographique… Nous étions en octobre et super des travaux sont en cours, c'est donc l'avis lié au moment que nous avons vécu et à notre expérience.Disneyland c'est mieux avec de petits enfants",3 contributions,it,None,"2,0 sur 5 bulles",no
nov. 2022 , En famille,MARVEL ET PLUS,C'est une option très intéressante et un complément parfait à Disney La décoration est vraiment impressionnante et la zone Marcel est impressionnante et avec des spectacles tout au long de la journée De nouvelles attractions sont en cours de construction pour compléter cette zone,"Oviedo, Espagne",es,None,"5,0 sur 5 bulles",yes
déc. 2021, En famille,voir avis,BonjourMe concernant ca fait longtemps que je ne suis pas venue à Disney mais je n'ai jamais pris le temps d'écrire un avis. J'y suis allée avec des amis en 2012 et j'en garde de bons souvenirs. Les décors attractions ...sont cools. Mais je pense que ca a pas mal changé depuis comme beaucoup de choses. Bien sûr comme dans tout parc il y a souvent de la queue avant il y avait un systeme de fast pass et c'était plutot pas mal j'espere que ca existe toujours. Je pense que vous devriez proposer plus des billets promo comme vous le faisiez avant en été du genre 2 billets achetés le 2eme à moitié prix. SI vous étiez moins cher vous auriez beaucoup plus de clients.C'est dommage que vos journées halloween ne soient pas proposées sur la journée car le soir les gens qui doivent prendre le métro ou rer c'est compliqué.,3 contributions,fr,Écrit le 21 novembre 2022,"3,0 sur 5 bulles",no
nov. 2022, En couple,Un de mes parcs à thème préférés,J'ai visité les parcs seul pour la première fois cette semaine et j'ai passé un moment formidable! J'ai adoré le thème des frondeurs WEB et j'ai passé un bon moment sur The Twilight Zone Tower of Terror! Monter plusieurs fois sur la tour est un must si vous voulez faire l'expérience de différentes chutes et intrigues ! Le parc la nuit est très animé et coloré avec des animations sur le campus Avengers jusqu'à la fermeture du parc.,1 contribution,en,None,"5,0 sur 5 bulles",no
nov. 2022 , En famille,Beau parc mais pourrait être mieux,"Le parc est agréable mais pourrait être tellement mieux qu'il est très décousu et désorganisé, ce qui est aidé par le fait que vous devez essayer de tout trouver sur votre téléphone maintenant qu'ils n'ont pas de cartes papier ! Les manèges sont bons mais semblent continuer à tomber en panne beaucoup plus que l'autre parc!","Sheffield, UK",en,Écrit le 21 novembre 2022,"3,0 sur 5 bulles",no
nov. 2022 , En famille,C'est plus ce que s'était ,"C'est plus ce que s'était... déjà a l'entrée. On avait auparavant la superbe vue sur walt et Mickey maintenant les portes sont fermés. Le nouveau parc avenger rien de nouveau ... spiderman n'est rien de plus qu'un buzz améliorer et iron man très déçue c'est Aerosmith sans musique dans le noir avec 3 pauvres écrans de cinéma. La nouvelle attraction cars c'est l ancien bus des studios avec des choses en moins ca va très vite. Et je ne parle pas des files d attente interminables ... quand a l attraction crash coaster des 8h30 déjà 100 minutes de file d attente et sinon c'est en maintenance impossible a faire. Enfin le spectacle de la reine des neige entassés debout voir assis les enfants ne voient rien et on se marche dessus, sauf si vous avez les moyens de vous payer un accès prenium la on vous installera dans des fauteuils pour bien marquer la différence. Aberrant ","Gap, France",fr,Écrit le 7 novembre 2022,"1,0 sur 5 bulles",no
nov. 2022, En famille,Décevant,"Nous avons apprécié les spectacles vivants mais avons été très déçus à la fois par le faible nombre d'attractions par rapport à la Floride mais surtout par les pannes à répétitions. Un grand nombre d'attractions sont ""en panne"" ou ""indisponible"" ce qui restreint énormément le choix restant pour lequel les files d'attente sont juste impossibles. Mon conseil est simple, n'y allez pas.Peut-être d'ici quelques années, quand Disney aura au minimum installé 5 attractions existant en Floride, cela pourrait faire sens.Même les enfants en avaient assez de faire la queue sans arrêt pour s'entendre dire que finalement l'attraction était en panne. C'est inacceptable pour la marque Disney.","Gourdan-Polignan, France",fr,Écrit le 7 novembre 2022,"3,0 sur 5 bulles",no
oct. 2022 , En famille,Étonnante!!,"Une expérience unique pour petits et grands, nous sommes allés avec des enfants de 9, 13 et 14 ans, deux garçons et une fille à : pirates des Caraïbes, Indiana Jones, le bateau, le train autour de la plaine, le château de la belle au bois dormant avec L'épée d'Arthur et l'autre parc à Ratatouille, Star Wars et dans les deux avec un vr plus simple dans l'autre, nous ne sommes pas tous entrés et tout le monde n'est pas entré dans un qui était égal à ce qu'ils ont trouvé, ils ont aimé les vengeurs se rassembler! Nourriture chez Annette's American Fantastic et voir les feux d'artifice !! Super!!","Athènes, Grèce",el,None,"5,0 sur 5 bulles",no
nov. 2022 , En famille,Trop de monde,Bonjour franchement beaucoup trop de monde 1h voir plus d’attente pour 3 mn de jeuTrès déçu au vu du prix qu’on dépense pour 2 jours au parc. Ce sera la dernière fois pour nous. Trop de profit fini par tuer le profit !!,"Aire-sur-la-Lys, France",fr,Écrit le 21 novembre 2022,"2,0 sur 5 bulles",no
oct. 2022 , En famille,Magnifique,Le deuxième parc Disney ! Il n'est pas encore terminé puisqu'il y a deux grandes zones actuellement en travaux (Frozen et une entre Star Wars et Pandora) mais toujours très très sympa,"Pietra Ligure, Italie",it,None,"5,0 sur 5 bulles",no
oct. 2022, En couple,SE DEMANDER,"Nous recommandons le nouvel hyperespace, le mémo coaster, et absolument la tour hollywood et les merveilleux spectacles",ferrara,it,None,"5,0 sur 5 bulles",no
oct. 2022, En famille,Beaucoup trop de monde !,"Beaucoup trop de monde ! Malgré un prix d'entrée élevé, les files aux attractions atteignent 60 minutes, ceci pour 3 minutes de plaisir ou de peur. Pas jouable avec des enfants. Cependant, un bon point pour les spectacles, genre ""reine des neiges"" = les acteurs chanteurs sont bons, même si les spectacles sont pour les 2/3 en anglais. Nous ne reviendrons pas en période de vacances scolaires.","Salles d'Aude, France",fr,Écrit le 3 novembre 2022,"3,0 sur 5 bulles",no
oct. 2022 , En famille,Épouvantable,"Même si le personnel et les équipements sont excellents ici, le parc est massivement abandonné en décomposant les manèges et rarement des personnages se rencontrent qui ne sont pas des spectacles. En plus d'être pendant la saison d'Halloween, il manquait énormément de décorations d'Halloween. Dans l'ensemble, mon expérience ici ne me donne pas envie de revenir. Mauvais effort disney",1 contribution,en,Écrit le 2 novembre 2022,"2,0 sur 5 bulles",yes
oct. 2022 , En famille,Incroyable juste quelques ajustements nécessaires,"Les studios Walt étaient incroyables, nous avons passé une si belle journée dans ce parc et nous sommes revenus pour la moitié de notre troisième jour. C'était vraiment quelque chose pour créer des souvenirs et vraiment s'amuser. Je déteste écrire quelque chose de négatif ici car c'était vraiment une bonne expérience mais c'est plus une suggestion, la zone des vengeurs était bien travaillée et nous avons adoré les spectacles mais s'il vous plaît, pourriez-vous envisager de rendre les personnages un peu plus disponibles (pas beaucoup mais juste un peu) mon fils est un grand fan de merveille au point où tout ce qu'il possède est une merveille, chaque jeu auquel il joue est basé sur une merveille, toute sa chambre est une merveille. Bien qu'il ait pu voir les personnages et dire un bonjour rapide et oui, ils l'ont vu et interagissent avec lui extrêmement rapidement, il était tellement déçu qu'il n'a pas pu le faire correctement au point où il a en fait couru après Thor mais il était un peu repoussé pour s'être rapproché, il ne comprend pas car il n'a que 6 ans, donc il était vraiment contrarié par cela. Nous avons essayé d'entrer pour rencontrer Spider-man (son préféré), mais personne n'a dit que nos billets n'avaient été utilisés qu'une seule fois, donc encore une fois, nous avons été déçus. Il y a beaucoup de monde là-bas, c'est pourquoi tout est une suggestion, mais quand il était si contrarié, je dois le faire dans mon avis. Nous avons cependant passé un bon moment, alors ne le prenez pas trop comme un négatif et nous reviendrons à un moment donné merci","Londres, UK",en,None,"4,0 sur 5 bulles",no
oct. 2022 , En couple,"Plus chiant que 2016, malheureusement","Nous étions ici en 2016, lorsque Studio Parks était le favori, et nous attendions avec impatience une réunion, mais malgré les bons acteurs qui jouaient les personnages de Marvel, les expériences qui ont soulevé 2016 ont disparu ou se sont transformées en quelque chose de plus ennuyeux. Il y a des temps d'attente BEAUCOUP trop longs pour les manèges.",1 contribution,da,None,"2,0 sur 5 bulles",no
oct. 2022 , En famille,Trop d'attente,"Dépensé une somme d'argent démesurée pour passer la journée à jouer sur le mobile dans diverses files d'attente. Les estimations de temps d'attente ne sont pas exactes. L'accès rapide / premier coûte plus cher que les hôtels Disney déjà chers. Cela va trop loin. Les attractions elles-mêmes sont pour la plupart bonnes, certaines excellentes, mais l'expérience dans son ensemble ne fonctionne tout simplement pas. Cela n'en vaut tout simplement pas la peine. Vous pouvez tirer le meilleur parti de votre journée, et pour beaucoup moins d'argent, à Paris même.",7 contributions,en,Écrit le 26 octobre 2022,"1,0 sur 5 bulles",no
oct. 2022, En famille,longues lignes,"Beaucoup trop de files d'attente et beaucoup trop de monde. Vous passez la majeure partie de la journée à faire la queue, donc vous ne pouvez pas aller vous amuser",3 contributions,da,None,"1,0 sur 5 bulles",no
oct. 2022 , En famille,C'etait mieux avant les pass premium!,"C'etait mieux avant!Oui je commence comme ça juste parce que même si Disney represente en grande partie la société de consommation et le marketing, avant on y allait pour les attractions. Aujourd'hui ils ont réussi à creuser encore plus des inégalités avec leurs PASS Premium. On attend plus d'une heure pour chaque attractions, les gens avec les pass font aussi la file d'attente, tout n'est pas ouvert.... Ca rend le moment de moins en moins féérique et ludique. Bref, plus envie d'entretenir ce système !","Genève, Suisse",fr,Écrit le 21 octobre 2022,"1,0 sur 5 bulles",no
oct. 2022 , En famille,"Aurait pu être génial, finalement déçu","J'ai visité les deux parcs le même jour avec celui-ci dans l'après-midi. Il y a une grande différence dans le thème de ce parc par rapport à Disneyland mais j'ai senti qu'il promettait beaucoup et n'a pas réussi à livrer. Heureusement, les files d'attente ne sont pas aussi folles que Disneyland mais quand même substantiel. Comme d'autres l'ont souligné, la mise en page est un gâchis et ressemble à un travail en cours par endroits. Les options de restauration sont médiocres par rapport au parc Disneyland. Les manèges sont bons si vous pouvez y monter même s'ils tombent souvent en panne. La merveille spiderman était celle que nous attendions tous avec impatience mais qui était hors service. Un autre manège était tombé en panne alors que les gens s'étaient installés dans les sièges. Cela étant dit, les manèges de ratatouille et de toy story étaient amusants. Vous pourriez sans doute passer quelques jours à essayer de tout couvrir car il y a des spectacles tout au long de la journée. Je pense que s'il peut surmonter ses problèmes de fiabilité et que le parc trouve un meilleur aménagement, cela pourrait être un endroit formidable à visiter et à apprécier.","Bradford, UK",en,Écrit le 21 octobre 2022,"3,0 sur 5 bulles",no
oct. 2022 , En couple,Amusant pour petits et grands,"Une splendide nouveauté pour les ""grands"" enfants avec des attractions plus audacieuses, et des sujets issus de l'univers Marvel et pas seulement pour capter l'attention des adultes et pas seulement, des spectacles en direct autour du parc et dans des théâtres dédiés, un énorme travail bien fait et c'est vaut le prix du billet, le seul défaut est le merchandising pas tout à fait adéquat, et les files d'attente un peu trop longues... mais sinon avec un peu de patience ça devient une expérience unique",4 contributions,it,None,"5,0 sur 5 bulles",yes
sept. 2022 , En famille,Très bien mais la magie manque,De très bons matchs mais beaucoup d'attente et c'était une journée pluvieuse où il n'y avait peut-être pas autant de monde que d'habitude. Il nous manquait l'immersion caractéristique de Disney en général.,2 contributions,es,None,"4,0 sur 5 bulles",no
oct. 2022 , En famille,De meilleurs manèges mais toujours une arnaque.,"Nous avons séjourné au Disney Studios pour le dernier jour de nos vacances. Contrairement à l'autre parc, tout est un peu plus moderne ici. Aussi les manèges. Néanmoins, vous devez payer un supplément ici si vous ne voulez pas attendre 75 à 100 minutes. Pour nous en famille jusqu'à 36.-€ Comme je l'ai dit, c'est à chacun de payer, mais avec un petit enfant, faites tout pour ne pas trop attendre.",Luzern,de,None,"3,0 sur 5 bulles",yes
oct. 2022 , En famille,Super !,L’avengers Campus vaut vraiment le coup et apporte un vrai plus à ce parc qui commencer à être sans nouveautés et moins attractif que le parc principal. Ce nouveau land est superbe et je reviendrais plus souvent dans ce parc du coup !,"Paris, France",fr,Écrit le 13 octobre 2022,"5,0 sur 5 bulles",yes
