dateSejour,situation,titre_comm,comm,loc,langue,dateAvis,note,photo
oct. 2019, Entre amis,Pas à la hauteur,"Parc très petit ,  peu d'attractions dans des hangars , et quand elle sont bien ils les changent. Bon , déjà Roll'n'coaster qui était reconnu pour le show , la théma et non pour les sensations va être detruit par marvel , la tour de la terreur est vraiment cool , Crush est très bien mais à un deit horaire de 700 personne par heure , soit vraiment catastrophique pour un parc de cette ampleur . Studios tram tour est inutile , les futurs land sont au disney asiatique , sans leurs grosses attractions . Leur land Toy Story à couté 80 MILLIONS D'EURO !! alors que ça en vaut 30 maximum , un très mauvais investissement . Sinon les cats sont cool , le parc propre mais pas à la hauteur du groupe disney .","Tournai, Belgique",fr,Écrit le 10 août 2020,"2,0 sur 5 bulles",no
juil. 2019 , En couple,Fantastique,"Grandes attractions, espace fantastique. Tout ce que vous attendez de Disney et encore plus Les billets sont un peu chers, mais ça vaut vraiment le coup. La nourriture sur place est chère. Espace très propre.","Aveiro, Portugal",pt,None,"4,0 sur 5 bulles",no
déc. 2019 , En famille,Superbe !,Attractions au top !Personnel dans le thème et souriant !Crush coaster et tower hotel sont extraordinaire.Ce genre d'attraction à gaire la matin où l'attente est le plus faible sinon pendant la parade.,"Strasbourg, France",fr,Écrit le 5 août 2020,"5,0 sur 5 bulles",no
nov. 2019 , En couple,visite obligatoire,"Tout est merveilleux, parc propre, attractions amusantes, personnel super attentionné. Seule la nourriture est moyenne, comme dans tous les parcs d'attractions. Cela ne laisse rien à désirer pour American Disney.","São Paulo, SP",pt,None,"5,0 sur 5 bulles",yes
déc. 2019, En famille,Coup de cœur pour la famille,"J'ai hâte de voir les rénovations et les nouveaux terrains qui doivent ouvrir dans le parc au cours de la prochaine décennie. La zone autour de ratatouille est toujours la zone la meilleure et la plus pensée du parc. Cela rend le reste du parc un peu fade. Contrairement à l'autre parc, il est trop spacieux et a beaucoup de vides. Surtout après la pression qui a traversé le bâtiment au début.","Oxford, UK",en,Écrit le 5 août 2020,"4,0 sur 5 bulles",no
oct. 2019 , En famille,Bon,"J'ai laissé une critique pour l'autre parc et c'était une diatribe. Nous y sommes allés le deuxième jour et c'était un peu mieux. Malheureusement, il n'a pas la même magie que la Floride, mais je ne veux pas recommencer à déclamer. Je ne veux pas non plus me répéter alors regardez mon autre commentaire sur Disneyland Paris. Si vous pouvez vous le permettre, j'irais en Floride. Ou économiser plus longtemps et aller en Floride. J'aimerais pouvoir donner à celui-ci un 3 et demi car il était légèrement meilleur que le DLP.","Huddersfield, UK",en,Écrit le 5 août 2020,"4,0 sur 5 bulles",no
janv. 2020, En famille,Dans le monde du.....cinéma,"Avec les Studios on entre dans le domaine du cinéma, alors ici l'imagination, la fiction, le fun, le frisson sont les maîtres. Il est divisé en quatre sections : ""Front Lot"" qui vous accueille dans un décor cinématographique qui rappelle Hollywood ; ""Production Courtyard"" s'ensuit, un hommage au grand cinéma et l'occasion de s'initier aux différentes étapes de la production cinématographique ; ""Toon Studio"" pour découvrir le monde fascinant des dessins animés (la dernière attraction est Ratatouille, vraiment sympa) et enfin ""Toy Story Playland"", un univers dédié aux jouets. Beau défilé et spectacles.","Ceccano, Italie",it,None,"5,0 sur 5 bulles",yes
déc. 2019, En couple,Un peu moins pour le moment,"pour le moment, beaucoup de choses sont en cours de développement et de nombreuses attractions sont fermées. Mais quand les nouveaux parcs à thème seront ajoutés, je pense que ce sera vraiment cool ! mais maintenant, il n'y a pas beaucoup d'ouvertures, mais des attractions amusantes, mais pas autant que l'autre parc.",1 379 contributions,nl,None,"3,0 sur 5 bulles",yes
nov. 2019 , En famille,Amusement !! Très bien !!,Plaisir garanti !! Il a d'excellents jouets pour les enfants et les adultes !! Très bon et amusant ! Plaisir garanti ! Il a d'excellents jouets pour les enfants et les adultes !! Très bon et amusant !!,"Belo Horizonte, MG",pt,None,"5,0 sur 5 bulles",yes
sept. 2019, En famille,"Première expérience Disney, impactée par les pannes/fermetures de manèges","Visité en groupe comprenant trois enfants de moins de 12 ans pour leur première expérience Disney - avait un laissez-passer de plusieurs jours pour deux parcs. Être dans n'importe quel parc Disney est formidable, bien que nous ayons constaté que de nombreux manèges et attractions ont connu des échecs et que certains ont également été totalement fermés (y compris un volume élevé de lieux de restauration). Fast Pass n'était pas toujours disponible, et certaines files d'attente en particulier étaient tout simplement trop longues pour que les tout-petits attendent. Même en utilisant Magic Hours (en séjournant dans une propriété Disney), il était très difficile de s'immerger complètement dans le parc et tout ce qu'il avait à offrir. Heureusement, comme nous avions étalé notre visite sur plusieurs jours, nous avons réussi à cocher la plupart des manèges et attractions, mais malheureusement, il en restait encore à faire. J'espère que nous pourrons revenir et découvrir à nouveau le parc complet à l'avenir.","Londres, UK",en,None,"4,0 sur 5 bulles",yes
mai 2019, En solo,A faire,"Le ""Parc Walt Disney Studios"" est à faire.Les attractions ont une cible plus âgée et plus à sensation que celui de ""Disneyland"".","Quimper, France",fr,None,"4,0 sur 5 bulles",yes
févr. 2020, Entre amis,Apprécié cela plus que le parc principal,Nous avions un laissez-passer commun pour aller ici et le parc principal. Je sais que c'est plus récent et je sais que c'est sur un thème différent mais j'ai senti qu'ils avaient ce parc juste et c'était une meilleure expérience que le parc principal. Cela vaut vraiment la peine d'acheter des billets pour les deux parcs. Ne vous embêtez pas avec l'application LineBuddy... complètement inutile et épuisée en 30 secondes. Ce n'est pas ce qu'il est censé être.,"Horley, UK",en,None,"4,0 sur 5 bulles",no
nov. 2019 , En famille,Il peut améliorer,"J'ai vraiment apprécié ma visite au parc Disneyland plus qu'aux studios Disney. Ce parc peut faire l'objet de nombreuses améliorations, mais c'est quelque chose que l'équipe Disney sait déjà puisqu'elle prévoit un agrandissement massif du parc avec de nouvelles attractions. Je suis sûr que dans les prochaines années, il deviendra aussi beau et intéressant que le parc Disney","Florence, Italie",en,Écrit le 10 août 2020,"3,0 sur 5 bulles",no
mars 2020, En famille,Merci aux casts de zigzag slinky dog,"J'ai séjourné à disney durant trois jours juste avant le confinement et c'etait un séjour exceptionel, les casts sont géniauxje remercie particulièrement les casts de slinky dog: ma fille s'est fait un peu mal  sur l'attraction, une très gentille casts est venue la réconforter et nous l'avons revue les lendemain, elle a été génialece parc est agréable, nous aimons surtout zigzag slinky dog et les tapis volant d'aladinNous avons apprécié les chalets de l'hiver gourmant et aussi les echoppes de snack reine des neiges, ça permets de manger de bonnes choses, moins cher que si nous etions dans un resto (je conseille à tous, le choco olaf, les sablés reines des neiges et la soupe de cabillaud)pour les spectacles: nous avons adorés mickey et le magicien, à tel point que nous y sommes allé deux fois pour l'invitation reine des neiges, c'est bien mais si on est devant, donc il faut arriver très très à l'avancepar contre pour les personnages, certains sont uniquement sur réservation et ça c'est vraiment nul!","Montignies-Saint-Christophe, Belgique",fr,Écrit le 4 août 2020,"4,0 sur 5 bulles",no
févr. 2020 , En couple,Ravi,"Est bien. C'est comme Warner Park mais en plus petit, à Crush coaster et Ratatouille il y a pas mal de file d'attente. Et Ratatouille tombe en panne tous les 2 x 3. Mais ne quittez pas la file d'attente si vous êtes déjà très avancé car ils règlent généralement le problème rapidement.","Santander, Espagne",es,None,"5,0 sur 5 bulles",no
févr. 2020, En couple,Parc pour sensations,"La tour / racer toys story et nemo parfaitSpectacle star war très bienDéçu de ratatouille, l extérieur et intérieur sont parfaits par contre l attraction est moyenne ",France,fr,None,"4,0 sur 5 bulles",no
mars 2020 , En couple,Un vrai monde Disney,"Beau et beau parc. En ce moment, ils font beaucoup de rénovations et il y a moins à faire pour les adolescents.","Purmerend, Pays-Bas",nl,None,"3,0 sur 5 bulles",no
mars 2020 , En famille,Pas sensationnel,Les + : - la propreté- le personnel- Les grosses attractionsLes -- le tour est vite fait si vous n'avez pas d'enfant ( en gros 3 attractions à faire)- beaucoup moins immersif que le normal,"Centre-Val de Loire, France",fr,Écrit le 10 août 2020,"3,0 sur 5 bulles",yes
mars 2020, En famille,Bons thèmes,"Histoire de jouets agréable à parcourir, plus de spectacles que de manèges ici ou dans d'autres zones pour se promener plutôt que de faire la queue pour","Crawley, UK",en,None,"4,0 sur 5 bulles",no
mars 2020 , En famille,Beaucoup de travaux et d attractions fermées ,"Nous avons plusieurs heures dans le Studio, malgré les travaux et les attractions fermées, nous avons adorés l endroit et les attractions.. Mention spécial pour le Tower of Horror que j ai adoré ainsi que aux casts members qui jouaient à la perfection leurs personnages! Parc a faire et a refaire ","Cravans, France",fr,None,"4,0 sur 5 bulles",no
août 2019, Entre amis,Excellent,"Walt Disney Studio est génial. Je recommande de faire les deux parcs et de profiter de la magie et des expériences. Apportez des bouteilles d'eau, difficile de trouver de l'eau fraîche sans payer.","Calgary, Canada",en,None,"5,0 sur 5 bulles",no
mars 2020 , En famille,Parfait ,"Très bon parcDes attractions très intéressantes .Temps d attente gérable avec l appli Disney et les fast pass.Parc très propre, personnel très souriant.","Royan, France",fr,None,"4,0 sur 5 bulles",yes
mars 2020 , En couple,Spectaculaire,"J'ai vraiment aimé, ils l'ont bien répété et aucun détail ne manque, même si cela devient un peu répétitif et que la zone des personnages pour prendre la photo pourrait être plus élaborée","Gran Canaria, Espagne",es,None,"4,0 sur 5 bulles",yes
févr. 2020, Voyage d'affaires,Décevant,"Les parcs Disney en France ne se comparent tout simplement pas aux parcs Disney aux États-Unis et au Japon (je les ai tous visités). Tout d'abord, ce parc est nettement plus petit que celui de Disney Studio en Floride et n'a pas la même sélection de manèges / spectacles. Les files d'attente sont longues et le personnel ne correspond pas aux attentes établies par le personnel de Disney dans d'autres parties du monde. Ils font un mauvais travail en matière de gestion de ligne (en particulier le spectacle Frozen). La coupe de ligne est apparemment une ""chose"" à Disney Europe et le personnel de Disney s'en fiche. Du côté positif, ils font un excellent travail avec plusieurs langues. Le manège Ratatouille et Crushes Coaster sont très amusantsEn résumé, ce n'est pas mal, mais pour le groupe Price et Disney, je m'attendrais à ce que cela corresponde aux parcs Disney dans d'autres parties du monde. Il y a tellement de choses à faire dans cette partie de l'Europe, il y a de meilleures utilisations du temps et de l'argent","Marlborough, MA",en,None,"2,0 sur 5 bulles",no
mars 2020 , En famille,Disney un demi studio,"C'est inadmissible de faire payer l'entrée  pleine tarif alors que le parc et en travaux,la moitié du parc et inaccessible il aurait pu nous prévenir au caisses,où faire payer la moitié du prix des billets,pour moi a l'heure actuelle le parc Disney studio est une grosse arnaque.Il faut attendre la fin des travaux pour y aller dans 3 ou 4 ans pour l'instant seul Disney land est intéressant.",2 contributions,fr,None,"1,0 sur 5 bulles",yes
août 2019 , En famille,Une longue journée,"Nous avons visité disneyland paris... c'était très amusant mais épuisant, les enfants sont très contents et anxieux, les adultes aussi mais fatigués, il y a beaucoup d'endroits et de jeux à visiter, pour profiter au maximum de la journée, l'idéal est de se rendre à ouverture à 10h. et allez d'abord à la maison de la terreur puis sortez les cartes pour pouvoir organiser la journée avec quelques jeux... les magasins de shopping sont merveilleux et chers, vous pouvez aussi manger de la nourriture rapide et chère, à certaines heures de la journée Tous les jours les voitures avec les personnages de Disney passent, il faut arriver à un endroit stratégique pour pouvoir voir, il y a beaucoup de monde","Quilpue, Chili",es,None,"5,0 sur 5 bulles",yes
févr. 2020 , En couple,Faites-le pour les enfants,"L'avis est l'opinion moyenne d'une famille de 5 personnes. Je lui donnerais 1 car les files d'attente sont trop longues et le passage rapide est difficile dans un si grand parc. Tout est une arnaque comme prévu. Mon enfant de quatre ans a fait la queue pendant 40 minutes pour des manèges très basiques et le parc pourrait facilement doubler les manèges pour enfants plus petits moyennant un coût car l'espace est là et améliorerait l'expérience de chacun. Dire que mes enfants de 5 et 8 ans lui ont tous deux donné 5/5, alors qu'est-ce que je sais, haha, tout tourne autour d'eux. Ce côté était mon plus agréable pour les jeunes enfants que le côté Disneyland.","Birmingham, UK",en,None,"3,0 sur 5 bulles",yes
mars 2020, Entre amis,Étonnante,"Sans rien signaler, personnel incroyable et super serviable, c'était juste dommage pour la pluie et le froid mais ce n'est pas la faute du parc 😂","Faro, Portugal",pt,None,"5,0 sur 5 bulles",yes
févr. 2020, En couple,En développement,"Le deuxième parc de Disney est encore en développement et vous ne devriez donc pas le comparer avec le parc principal. Il y a beaucoup moins d'attractions et vous pouvez donc parcourir un long chemin en une journée. Cependant, il y a relativement de nombreux spectacles dans ce parc, vous pouvez donc facilement occuper votre temps. Il y a une énorme section Marvel en construction qui rendra ce parc beaucoup plus attrayant. Ici, utiliser votre Magic Pass comme un Fast Pass est une solution idéale pour visiter des attractions telles que Ratatouille et la Tour de la Terreur sans trop attendre. Si vous réservez un voyage de plusieurs jours à Disney, vous ne devriez certainement pas sauter ce parc.","Dordrecht, Pays-Bas",nl,None,"4,0 sur 5 bulles",no
févr. 2020 , En famille,Merveilleux,ON a passés trois jours Merveilleux  ..dommage que c été le week-end trop de monde 1h30 d attente  pour les attractions sinon le parc est trop beau a voir.  y avait la navette gratuite  devant l hotel pour se rendre au parc vraiment pratique  on envisage  deja d y  retourné mais en semaine cette fois ci,1 contribution,fr,None,"5,0 sur 5 bulles",no
mai 2019 , En couple,À faire sans hésitez,En complément du parc Disney.. mais dans un univers moins Disney mais plus fun pour les ados et adulte...de bon show et un menions spécial pour l attraction Aerosmith...meme conseils tres important que pour Disney ....venez en semaine et hors vacances scolaire pour éviter les files d attente interminables.. ,"Corme Royal, France",fr,None,"5,0 sur 5 bulles",no
avr. 2019, En famille,C'est bon,"Je suis un grand fan de Disney donc il n'en faut pas beaucoup pour m'impressionner mais pour être honnête j'ai trouvé ce côté de Disneyland un peu moyen. J'aime le look du parc... l'entrée est assez impressionnante avec la fontaine et le parc intérieur (également une bonne option en hiver quand le temps peut être aléatoire) et la thématique générale du parc est bonne. Cependant, il est beaucoup plus petit que les autres parcs Disneyland et se sentait très à l'étroit par endroits. Les temps d'attente pour le trajet étaient également très longs lors de notre visite qui était pendant les vacances scolaires. Ils avaient un événement Star Wars quand nous étions là-bas, ce qui signifiait que vous pouviez acheter de la nourriture à thème, il y avait un défilé et des spectacles en journée et un spectacle en soirée avec des feux d'artifice, etc. Tout cela était amusant mais encore une fois sans comparaison avec l'autre parc. J'ai entendu dire qu'ils cherchaient à agrandir ce parc, ce qui pourrait apporter des améliorations. Je ne pense pas que j'irais à Disneyland uniquement pour ce parc, mais si vous avez des laissez-passer pour plusieurs parcs, cela vaut la peine d'y aller.","Bedworth, UK",en,None,"3,0 sur 5 bulles",no
févr. 2020 , En famille,"2 montagnes russes, rien d'autre","Vraiment 3x rien, assez scandaleux que vous deviez payer autant d'argent ici. 2 belles attractions, le reste n'est rien","Beusichem, Pays-Bas",nl,None,"1,0 sur 5 bulles",no
févr. 2020 , En famille,Trop de monde,"Nous sommes allés à Paris et avons séjourné à Santa Fe, nous avons donc pu entrer dans les parcs à 8 h 30 avant le grand public. Même avec cette entrée anticipée, tous les manèges principaux des studios Walt Disney étaient déjà dans des files d'attente de 60/70 minutes et en raison de fortes pluies, les autres manèges n'étaient pas une option. Je pensais faire la queue pour le spectacle gelé, mais avec tout le monde obligé d'attendre dans la rue sous la pluie, mon enfant de 3 ans n'allait pas durer les 40 minutes d'attente. J'ai même essayé de réserver la rencontre et l'accueil d'Olaf 4 fois sur l'Ap (pas d'autre option), un système épouvantable car il réserve en quelques secondes les places disponibles à 0945 (espaces AM) 1315 (espaces PM) Sauf si vous allez dans l'un des les mois calmes que je sais maintenant sont les jours de semaine en janvier, septembre et novembre, profitant de la file d'attente !!!","Horley, UK",en,None,"2,0 sur 5 bulles",no
mars 2019, En famille,rock n roller coaster,que repose en paix rock n roller coaster la meilleure attraction du parc tu restera dans nos coeurs adieu rock,2 contributions,fr,None,"4,0 sur 5 bulles",no
févr. 2020 , En famille,Très bien ,"Malgré beaucoup d'attractions fermées suite à une grosse réhabilitation, nous avons un très bon séjour. Le spectacle Mickey et le Magicien est à ne pas rater. Tout comme les attractions Ratatouille,  Hollywood Tower Hotel,  RC Racer, Crush Coaster, etc... de quoi passer de bons moments. Le spectacle de cascade n'a pas changé depuis de nombreuses années mais il est toujours aussi surprenant.","Marignane, France",fr,None,"4,0 sur 5 bulles",yes
févr. 2020 , En couple,Épouvantable,"Très petit et très mauvais; Ça ne vaut pas la peine d'aller dans ce parc, il a 2 bons manèges mais ce n'est rien comparé à ses frères de Californie et d'Orlando","Apodaca, Mexique",es,None,"1,0 sur 5 bulles",no
oct. 2019 , En famille,Rien à voir,"Je suis allé à l'horaire du matin pour attraper une journée, mais il suffit de regarder autour d'une demi-journée. Il n'y a pas d'installations pour en profiter. Disneyland Paris lui-même est décevant.",405 contributions,ko,None,"3,0 sur 5 bulles",no
févr. 2020 , En famille,Jolie spectacle ,"Beau spectacle avec la reine des neiges, mickey et le magicien  et l'animation ext star wars. Dommage que rollercoster n est plus en service.",34 contributions,fr,None,"4,0 sur 5 bulles",no
févr. 2020 , En famille,Star wars et la reine des neiges à l’honneur ,"Quand on va à Disney, cela se prépare financièrement et psychologiquement lol. Ne prévoyez pas de faire 15 attractions dans la journée  sinon , colère & frustration assurées . C’est pas un investissement d’y aller ou de s’imaginer pouvoir « rentabiliser » cette sortie  en terme de nombre d’attractions faites ou de temps « optimisé » . Pareil pour l’attente , ce parc est unique en Europe donc victime de son succès. En terme de prix faut pas s’attendre non plus a des cadeaux et faire mine d’être surpris par les tarifs sinon n’y allez pas. Il y a assez de commentaires sur internet pour éviter que les gens soient surpris ou haineux dans leurs propos. Aussi , emmener des enfants de moins de 5 ans ça sert à rien. Ils vont s’impatienter , ils ne savent pas apprécier, vont trop marcher ,chouiner dans les files d’attente donc faut pas s’étonner que ça engendre un stress supplémentaire pour les parents . Bref , nous nous sommes rendus en famille le samedi 22 février avec nos enfants de 8 et 10 ans à 11h . Bien sûr j’avais pris des billets avec mon comité d’entreprise valables sur les 2 parcs car cela ne me viendrait jamais à l’idée de payer 100€ le billet / personne pour la journée ou de passer un week-end à prix exorbitant pour faire 8 attractions en 2 jours . 1h d’attente pour aller voir l’invitation musicale de la reine des neiges . Heureusement cela nous a beaucoup plu , le château de glace est super et Elsa les chanteurs sont très bons , hypers pro. Oui c’est le spectacle est en Anglais  , Disney c’est américain et il est temps de se mettre à l’anglais comme nos enfants dès la fin de maternelle/Cp !  Pendant le spectacle les parents se plaignaient . Ensuite on a déjeuné à 15h ( on avait pris des sandwiches, des pringles , de l’eau  dans nos sacs à dos en amont) tranquilles dans un fast food pour 37€ en écoutant un orchestre jouer les morceaux de star wars : c’était fantastique ! Nous avons fait les animations star wars , mon fils a été émerveillé. Les personnages viennent à notre rencontre, stormtrooper, Darkvador, kylo ren.... j’ai apprécié de voir cette interaction entre les acteurs et le public. Puis nous sommes allés dans l’autre parc, ensuite retour pour la célébration galactique à 20h et là c’était magique pour nous 4 . Nous sommes tous repartis avec des étoiles noires dans les yeux :-) . Show laser, extrait des meilleurs images de la saga sur la tour de la terreur , démonstration magnifique de sabre laser par dark maul,   tous les personnages sont sur scène à la fin . Mickey le magicien, le spectacle avec les cascades automobiles sont très bien nous les avons vu en juin dernier. Mention spéciale aux thèmes de star wars et de la reine des neiges qui nous ont enchanté. ","Versailles, France",fr,None,"4,0 sur 5 bulles",yes
févr. 2020 , En couple,Top ,J adore ce parc.  C est mon préféré. Dommage que les files d attente soit si longues pour les attractions principales!Mais c tj magique Et fan de star wars allez y c le pied.,"Astaffort, France",fr,None,"5,0 sur 5 bulles",yes
févr. 2020, En famille,bof....,"Décçu de ce parc, autant Disneyland dépayse, autant studio me fait penser à des boites mises les unes ç côté des autres sans les décors.","Tousson, France",fr,None,"3,0 sur 5 bulles",no
nov. 2019, En famille,disney france,"Je vais ici répéter l'évaluation que j'ai faite de Disney Paris, Disney fait partie des endroits qu'il faut visiter au moins une fois dans sa vie. Le charme est hors de ce monde. L'effort qu'ils font pour vous rendre heureux est remarquable.Divisé en deux parcs, beaucoup plus petit que celui d'Orlando, mais au charme unique, il vaut le détour. La plupart des attractions sont les mêmes, mais les petites différences rendent les manèges uniques.Le spectacle de musique et de danse valait le déplacement.","Catanduva, SP",pt,None,"5,0 sur 5 bulles",yes
févr. 2020 , En couple,Ne vaut pas la peine,Parc petit et fade. Beaucoup de temps perdu. Faites la queue pour entrer et ensuite vous devez sortir et entrer dans une autre file d'attente pour aller dans l'autre parc à côté.,5 contributions,pt,None,"1,0 sur 5 bulles",no
févr. 2020 , En famille,Parc plus petit très cool,"Nous étions à Disney pendant 2 jours et avons décidé de faire ce parc en premier à cause des vents violents. Parce qu'il est plus petit, vous pouvez faire tous les manèges que vous voulez et voir des spectacles. Il a également une sensation ""dans les coulisses"" mais n'est pas aussi magique que le parc principal. Ils ont cependant les meilleures informations sur différents types d'animation et vous pouvez même assister à un didacticiel pour dessiner un personnage Disney. Nous avons Mickey ! Dans l'ensemble, un parc d'attractions.","Londres, UK",en,None,"4,0 sur 5 bulles",no
févr. 2020 , En famille,Très bien mais longues attentes ,"Les meilleures attractions selon moi de ce parc (par ordre d’intérêt)- animagique theater avec les comédies musicales de Disney en live- crush’s coaster Nemo: bien mais attente interminable de 90 à 120 minutes. Même à l’ouverture des hôtels du parc à 8h30 tout le monde se jette dessus. C’est une sorte de grand 8 pour enfants meme petits. - ratatouille- Hollywood tower - moteurs action (immanquable, j’adore)- rc racer","Laurens, France",fr,None,"4,0 sur 5 bulles",no
févr. 2020 , En famille,Seule déception le nombre d’attractions fermées ,Super visite avec nos enfants. L’attente reste acceptable seul regret le nombre d’attractions ferme vu le prix du billet. Le temps a été au rendez vous. Que de bons souvenirs encore une fois. ,"Châtenoy-le-Royal, France",fr,None,"4,0 sur 5 bulles",no
